Comm_ID,Account of relevés,Locations of relevés,Authors,Year of occurances
3609,13,Upper Bavaria (Germany),Braunhofer,n.n.
3609,36,Swiss Plateau,Klötzli,1969
3609,11,Lake Constance area (Germany),G. Lang,1973
3610,6,"Harz, medium altitudes of the mountain and hill country in NW Germany, on silicate soils, fertilized, single-row mowing. (Germany)",Tüxen,1937
3610,7,Upper Palatinate (Germany),Lutz,1950
3610,200,all Czech stands at higher altitudes (Česko),Chytry et al. 2007,1975/2007
3611,8,"Harz, Rhön, Black Forest, altitudes 400-600 m, fertilized, single-row mowing, subsequent grazing (Germany)",Tüxen,1937
3611,10,from Baar (plateau between Black Forest and Swabian Alb) (Germany),"W. Krause, G. Lang, Oberdorfer",n.n.
3611,2,"subalpin pasture over Sopron, probably also at Kőszeg (Hungary)",Soó 1964,1964
3611,26,Black Forest (Germany),Oberdorfer,1957
3611,16,Vogelsberg (Germany),R. Knapp,1951
3611,7,Taunus (Germany),Lötschert,1973
3611,20,Swabian Alb (Germany),Th. Müller,n.n.
3611,n.n.,"Départements Meurthe-et-Moselle, Vosges (France)",Julve ,2024
3611,29," most common in the Krkonoše, Jizerské hory and Orlické hory Mountains, scattered stands in other mountain ranges of the Bohemian Massif(Česko)",Chytry et al. 2007,1975/2007
3611,9,Bohemian Forest (Czech Republic),Moravec,1965
3612,4,Black Forest (Germany),Oberdorfer,1957
3612,1,Black Forest (Germany),Bartsch,1940
3612,1,Northern Black Forest (Germany),Oberdorfer,1957
3612,45,"montane belt of the Krušné hory Mountains, Jizerské hory and west-ern Krkonoše Mountains (Česko)",Chytry et al. 2007,1975/2007
3612,n.n.,"Départements Ardennes, Meurthe-et-Moselle, Vosges (France)",Julve ,2024
3612,1,Northern Black Forest (Germany),Bartsch,1940
3613,n.n.,"Départements Savoie, Haute-Savoie (France)",Julve ,2024
3613,5,Tegernsee area (Germany),E. Siede,1960
3613,25,Allgäu (Germany),R. Knapp,1951
3613,3,Allgäu (Germany),Oberdorfer,n.n.
3911,16,middle Elbe floodplain (Germany),Passarge,1960
3911,,in the floodplains of large lowland rivers and in broad floodplains of smaller streams at higher altitudes (Česko),Chytry et al. 2007,1975/2007
3911,n.n.,"Regions Hauts-de-France, Grand Est, Bourgogne and Départements Ain, Isére, Drome, Seine-Maritime, Calvados, Orne, Puy-de-Dome (France) ",Julve ,2024
3911,10,"Sátor, Bükk, Tornai Karszt, Naszály, Transdanubia: Vas, Sopron, Somogy, Zala, Green hills of Gödöllő, Nógrád-Cserhát,  (Hungary)",Soó 1964,1964
3912,11,middle Oder valley (Germany),Freitag,1957
4000,2,South-Mecklenburg and Brandenburg (Germany),Passarge,1964
4021,7,Island of Vilm and Darß (Germany),"Bochnig, Fukarek, Libbert",1959
4021,5,"Western parts of the East Frisian Islands, North- Frisian Islands, shallow decalcified humus-rich dunes, sheep pastures (Germany)",Tüxen,1937
4040,6,Inn floodplain near Rosenheim (Germany),Pfrogner,1973
4040,7,Berchtesgarden Alps (Germany),Lippert,1966
4040,1,Franconian Alb (Germany),Korneck,n.n.
4040,6,Upper Rhine area (Germany),Oberdorfer,1957
4040,n.n.,"Départements Vosges, Moselle (France)",Julve ,2024
4040,85,"common in the flysch Carpathians, rare and isolated occurrences in northern and central Bohemia (Česko)",Chytry et al. 2007,1975/2007
4040,2,northern Upper Rhine Plain (Germany),Korneck,n.n.
4040,6,Isar floodplain north of Munich (Germany),Seibert,1962
4040,61,Swabian Alb (Germany),Th. Müller,n.n.
4040,2,South Mecklenburg and Brandenburg (Germany),Passarge,1964
4041,3,Berchtesgaden Alps (Germany),Lippert,1966
4042,1,Bohemian Forest (Czech Republic),W. Braun,n.n.
4042,2,Bohemian Forest (Czech Republic),Moravec,1965
4042,1,Bohemian Forest (Czech Republic),Preising,1953
4042,18,"high mountain ranges below the timberline in the Krkonoše, Orlické hory, Hrubý Jeseník and Šumava Mountains (Česko)",Chytry et al. 2007,2007
4042,1,Bohemian Forest (Czech Republic),Oberdorfer,1957
4043,4,Swabian Alb (from Tuttlingen to Aalen) (Germany),R. Hauff,1936
4043,44,Swabian Alb (from Tuttlingen to Aalen) (Germany),Th. Müller,n.n.
4043,3,Swabian Alb (from Tuttlingen to Aalen) (Germany),O. Wilmanns,1956
4043,12,Lower Regental (Germany),Zielonkowski,1972
4043,5,Lower Regental (Germany),"Linhard, Stückl",1972
4043,6,Swabian Alb (from Tuttlingen to Aalen) (Germany),K. Kuhn,1937
4044,4,Upper Bavaria (Prealps) (Germany),W. Braun,n.n.
4044,n.n.,Wilder Kaiser in Tyrol (Austria),Zöhrer,1978
4044,n.n.,Tennengebirge in the Salzburg Limestone Alps (Austria),Hartl,1976
4044,n.n.,Postalm area in the Salzburg Limestone Alps (Austria),Breitfuss,1976
4044,n.n.,Teichalm in the Styrian Randgebirge (Austria),"Zimmermann, Maurer",1989
4044,n.n.,Hochkönig in the Salzburg Limestone Alps (Austria),Weinmeister,1983
4044,n.n.,Grubwiesalm near Gaming (Lower Austria),"Grabherr, Zechmeister",1989
4044,2,Upper Bavaria (Prealps) (Germany),Buchwald,n.n.
4044,n.n.,Carpathians,Mraz,1956
4044,6,Upper Bavaria (Prealps) (Germany),Siede,1960
4044,n.n.,Göstlinger Alps (Austria),Schantl,1986
4044,2,Upper Bavaria (Prealps) (Germany),Oberdorfer,1950
4044,n.n.,Tennengebirge in the Salzburg Limestone Alps (Austria),Weiskirchner,1978
4044,n.n.,Sommeralm in the Styrian Randgebirge (Austria),Strassegger,1981
4151,15,northern slopes of the Porphyrkuppen landscape north of Halle (Germany),Schubert,1960
4151,14,common in dry colline landscapes and lowlands of central Bohemia and south-western Moravia (Česko),Chytry et al. 2007,1975/2007
4201,5,"widespread, e.g. at Debrecen,, Danube floodplain, Eger, Szarvaskö, Velencei-tó  (Hungary)",Soó 1964,1964
4201,10,eastern Bavaria (Germany),Klapp,1951
4201,16,Nahe valley and near Mainz (Germany),Oesau,n.n.
4201,8,South Mecklenburg (Germany),Jeschke,1959
4201,12,eastern Bavaria (Germany),Vollrath,1965
4201,1,"Lowland, especially in Kisalföld (Hungary)",Soó 1964,1964
4201,6,"Leine, Aller, Weser, Elbe valleys in summer-dry oxbow beds on silt-rich, air-poor soils (Germany)",Tüxen,1937
4201,n.n.,"Regions Normandie, Haute-de-France, Ille-de-France (France)",Julve ,2024
4201,25,Mecklenburg a. West-Brandenburg (Germany),Passarge,1959
4201,n.n.,Large and small valleys in Departement Cher (France),Pujol et al. 2023,n.n.
4201,6,Odenwald and Tauber area (Germany),Philippi,n.n.
4201,1,from Baar/Hüfingen (plateau between Black Forest and Swabian Alb) (Germany),Philippi,n.n.
4201,183,"large parts of Europe, with centre of gravity in temperate areas; In Netherland in riverine areas, in low moorland and sea clay areas",Schaminée et al. 2010,2010
4202,8,Lake Constance shore (Germany),G. Lang,1973
4202,3,northern Upper Rhine area (Germany),Korneck,n.n.
4202,5,Wutach Gorge (Germany),Oberdorfer,1971
4202,45,"from the banks of the Danube, Erms, Eyach, Fils, Iller, Jagst, Kocher, Lenninger Lauter, Neckar, Rhine, Rems, Seefelder Aach, Starzel, Steinlach, Tauber (Germany)",Th. Müller,1961
4202,5,southern Upper Rhine (Germany),Th. Müller,1974
4202,5,Danube flood plain (Hungary),Soó 1964,1964
4203,6,Upper Rhine plain (Germany),Oberdorfer,1957
4203,n.n.,"Départements Haute-Rhin, Bas-Rhin (France)",Julve ,2024
4214,n.n.,"Départements Savoie, Haute-Savoie, Haute-Alpes, Alpes de Haute-Provence (France)",Julve ,2024
4214,10,Allgäu (Germany),Oberdorfer,1950
4214,7,Montafon (Vorarlberg/Austria),Oberdorfer,n.n.
4215,3,Allgäu (Germany),Oberdorfer,1950
4215,15,Allgäu (Germany),S. Görs,n.n.
4216,5,Swabian Forest (Germany),Rodi,1961
4216,10,Swabian Alb (Germany),Th. Müller,n.n.
4216,3,Black Forest (Germany),Oberdorfer,1957
4216,1,Black Forest (Germany),Tüxen,1942
4216,2,Black Forest (Germany),Klapp,1950
4216,n.n.,"Départements Alpes de Haute-Provence, Hautes-Alpes, Savoie, Haute-Savoie (France)",Julve ,2024
4217,12,Berchtesgaden Alps (Germany),Lippert,1966
4217,8,Buching-Trauchgau/Allgäu (Germany),"Siede, Vollrath",n.n.
4217,5,Ostertal/Allgäu (Germany),E. Siede,1960
4218,5,salty sandy beach of the North- Sea and Baltic Sea on primary dunes (Germany),Tüxen,1937
4218,1,Island Borkum (Germany),Preising,n.n.
4218,27,Island Spiekeroog (Germany),"Wiemann, Domke",1967
4218,24,North- Sea coast of Lower Saxony (Germany),Tüxen,n.n.
4290,5,Bay of Wismar (Germany),Passarge,1964
4290,5,Hiddensee (Germany),Fröde,1950
4501,7,Darß (Germany),Libbert,1940
4502,7,Darß (Germany),Libbert,1940
4730,4,Middle-Mecklenburg (Germany),Passarge,1964
4731,19,Swabian Alb (Germany),"R. Hauff, Th. Müller",1936
4731,8,Black Forest (Germany),Oberdorfer,1957
4731,14,Upper Palatinate and Bavarian Forest (Germany),"Preising, Oberdorfer, W. Braun",1953
4731,23,"most common in northern and north-western Bohemia, in the Třeboň basin of southern Bohemia and elsewhere in the mountains (Česko)",Chytry et al. 2007,1975/2007
4731,n.n.,"Départements Vosges, Meurthe-et-Moselle, Moselle, Ardennes, Aisne, Nord, Pas-de-Calais (France)",Julve ,2024
4731,5,Waldenburg Mountains (Germany),"H. Scheerer, Th. Müller",1956
4731,5,Welzheim Forest (Germany),D. Rodi,1961
4731,6,Alpine foothills (Allgäu and Tölz) (Germany),"K. Buchwald, Görs, Oberdorfer, W. Braun",1951
4731,n.n.,Mesohygrophilous communities on more or less drained and/or compacted peaty soil in Val de Loire (France),Pujol et al. 2023,n.n.
4732,7,SW Mecklenburg (Germany),Passarge,1964
4732,23,Prignitz (Germany),Fischer,1960
4733,2,Boa Nova near Porto (Portugal),Braun-Blanquet 1967,1967
4734,2,Gurutze (Spain),Braun-Blanquet 1967,1967
4734,5,Monte Igueldo near San Sebastian (Spain),Braun-Blanquet 1967,1967
4734,2,Cap du Figuier  (Spain),Braun-Blanquet 1967,1967
4734,1,Ajako Arri (Spain),Braun-Blanquet 1967,1967
4734,2,Guadalupe over Fuenterrabia (Spain),Braun-Blanquet 1967,1967
4734,4,Jaizkibel (Spain),Braun-Blanquet 1967,1967
4748,n.n.,"Regions Pyrénées, Normandie, Bretagne and Départements Sarthe, Maine-et-Loire, Vienne, Haute Vienne, Creuse, Allier, Puy-de-Dome, Corrèze, Cantal, Lozère, Ardennes (France)",Julve ,2024
4750,n.n.,"Départements Haut-Rhin, Bas-Rhin, Haute-Marne, Aube, Marne, Saone-et-Loire, Cote d'Or, Yonne, Haute-Saone, Meuse (France)",Julve ,2024
4750,7,"North-West-Germany, unfertilized wet single-row mowing meadow (Germany)",Tüxen,1937
4750,6,Riparian meadows of the Müritz south of Waren/Mecklenburg (Germany),Passarge,1964
4751,13,"in the North-West-German lowlands, in the area of the Querceto-Betuletum (Germany)",Tüxen,1937
4771,21,"South-West-Mecklenburg, Altmark (Germany)",Passarge,1964
4771,10,Prignitz (Germany),Fischer,1960
4771,97,"from Belgium, the Netherlands, north-western Germany to northern Denmark. In the Netherlands in the Pleistocene sandy regions, uutside on gravel heads in Mergelland and in the dunes of Goeree.",Schaminée et al. 2022,
4772,6,"Central mountains: Sátor; Transdanubia: Vas, Zala, Somogy; Tornai Karszt, Western Bakony: Uzsa; Balaton-vidék: Kisörs (Hungary)",Soó 1964,1964
4772,7,"Havelland, Middle- and East-Brandenburg (Germany)",Passarge,1964
4773,1,"Klein-Leipsch, Krössinker Heath, west of Nebesdorf forestry (Germany)",Krieger,1936
4773,1,"Blesen, forest Schwerin (Warthe) (Germany)",Krieger,1935
4773,1,"Strega, Jänschwalde forest on the way to Grabko (Germany)",Krieger,1935
4773,1,"Perleberg, Uenzer Heath (Germany)",Krieger,1935
4773,1,Perleberg city forest on the border to Uenzer Heide (Germany),Krieger,1935
4773,2,"Beelitz, Karin Heath (Germany)",Krieger,1935
4773,1,flat dune valley in the Swatze mountains near Spreenhagen (Germany),Krieger,1936
4773,1,Forest Baruth (Germany),Krieger,1935
4773,1,Storkow city forest on the eastern shore of the Kleiner Griesensee lake (Germany),Krieger,1935
4774,6,Schwarzwald (Black forest) (Germany),Bartsch & Bartsch 1940,1940
4774,11,"northern mountains of Forez, Vosges, Morvan",Thébaud 2011,2011
4774,5,"Upper Harz, Solling (high moors) (Germany)",Tüxen,1937
4774,12,"Northern Black Forest (Hornisgrinde, Schliffkopf, Kniebis, Alexanderschanze, Zuflucht) (Germany)",Dierßen,n.n.
4774,1,"Northern Black Forest (Hornisgrinde, Schliffkopf, Kniebis, Alexanderschanze, Zuflucht) (Germany)",Oberdorfer,1969
4774,n.n.,"Regions Bretagne, Normandie, Hauts-de-France and Départements Haute Vienne, Creuse, Corrèze, Cantal, Landes, Pyrénées-Atlantique (France)",Julve ,2024
4775,n.n.,"at Saint-Martin-d'Abbat (Departement Loiret, France) on a hillside overlooking the Loire",Pujol et al. 2023,n.n.
4775,5,West Mecklenburg (Germany),Passarge,1964
4778,12,Bretagne,Thébaud 2011,2011
4778,11,Limousin,Thébaud 2011,2011
4778,20,"Atlantic lowlands of NW Germany (climax area of Betulo-Quercetum), wet nutrient-poor lowlands, on acid peat",Tüxen,1937
4778,n.n,"at Neuvy-sur-Barangeon (Departement Cher, France) in Sologne",Pujol et al. 2023,n.n.
4778,61,"small atlantic to subatlantic range in Europe. In the Netherland in Drenthe, Overijssel, Gelderland and North Brabant, in Twente and in Limburg, east of the river Maas, among others.",Schaminée et al. 2010,2010
4778,11,Ardennes,Thébaud 2011,2011
4778,4,Ems region (Germany),Jonas 1932,1932
4779,n.n.,corresponding sites in wet dune valleys of the Baltic coast and the North- and East Frisian Islands (distribution from the Baltic to the southern border of the Dutch Wadden District),Pott,1992
4780,21,High Vosges,Carbiener,1970
4781,10,Upland of the Swabian Alb (South-West-Alb to Härtsfeld) (Germany),K. Kuhn,1937
4781,5,Upland of the Swabian Alb (South-West-Alb to Härtsfeld) (Germany),Faber,1934
4781,39,Upland of the Swabian Alb (South-West-Alb to Härtsfeld) (Germany),Th. Müller,n.n.
4800,12,"North-West-Germany (fresh lake marshes, loamy-clay river marshes on the Weser, pasture) (Germany)",Tüxen,1937
4800,9,"East Brandenburg, SE Mecklenburg (Germany)","Arndt, Passarge",1955
4800,n.n.,"Regions Hauts-de-France, Grand Est, Bourgogne, Bretagne, Pays de la Loire, Ille de France, Normandie and Départements Charente Maritime, Charente, Deux Serves, Vienne, Dordogne, Lot, loire, Rhone (France)",Julve ,2024
4800,30, distributed throughout the Czech Republic,Chytry et al. 2007,1975/2007
4800,n.n.,"Mesophilic, eutrophilic to hypertrophilic, neutrophilic meadow, intensively grazed in Departments Cher,  l'Eure-et-Loir, Indre, Indre-et-Loire, Loir-et-Cher, Loiret (France)    ",Pujol et al. 2023,n.n.
4800,n.n.,at Saint-Viâtre in Sologne,Pujol et al. 2023,n.n.
4800,7,"mountain pastures of the Közep Mountains and the Danube, Kisalföld (Hungary)",Soó 1964,1964
4800,5,"East-Brandenburg, South-east-Mecklenburg (Germany)","Arndt, Passarge",1955
4800,28,"Middle-, North- and West-Mecklenburg (Germany)","Raabe, Fröde, Passarge",1944
4801,1,Neckar area (Germany),Th. Müller,1958
4801,5,Upper Rhine area (Germany),"von Rochow, Oberdorfer, G. Lang",1951
4801,3,Neckar area (Germany),Oberdorfer,n.n.
4801,12,Upper Swabia and Upper Bavaria (Germany),S. Görs,n.n.
4801,4,Upper Swabia and Upper Bavaria (Germany),"Speidel, Buchwald",n.n.
4801,23,"Middle-, North- and West-Mecklenburg (Germany)","Raabe, Fröde, Passarge",1944
4801,2,Swabian Alb (Germany),Th. Müller,n.n.
4801,6,Odenwald (Germany),R. Knapp,1946
4803,10,"Sátor-hegység, Bükk,  Matra, Börzsöny, Őrség, Vend-videk, Zselic, Visegrád-Szentendre Hills, Pilis, Zala (Hungary)",Soó 1964,1964
4803,n.n.,"Départements Alpes de Haute-Provence, Hautes-Alpes, Savoie, Haute-Savoie, Jura, Doubs, Vosges, Meurthe-et-Moselle, Moselle, Ardennes (France)",Julve ,2024
4803,40,"Middle-, North- and West-Mecklenburg (Germany)","Raabe, Fröde, Passarge",1944
4880,3,Middle- Elbe Valley (Germany),Passarge,1964
4880,6,Middle- and East-Mecklenburg and Havelland (Germany),Passarge,1964
4920,n.n.,"in a path bordering an alkaline marsh at Mignerette (Departement Loiret, France) in the Gâtinais.",Pujol et al. 2023,n.n.
4920,4,Mecklenburg and Altmark (Germany),Passarge,1964
4920,7,East-Mecklenburg and Brandenburg (Germany),Passarge,1964
4920,28,common throughout the whole Hungary,Soó 1964,1964
4920,n.n.,"Medium topography, with little winter flooding (farm entrances, roadsides) in Departement Cher (France)",Pujol et al. 2023,n.n.
4921,39,common from lowland to submontane areas across the Czech Republic,Chytry et al. 2011,1975/2011
4921,1,Neckar region (Germany),Krehl,1929
4921,1,Upper Rhine area (Germany),Oberdorfer,1957
4921,n.n.,"all French Regions except coast of Occitanie, Provence-Alpes (France)",Julve ,2024
4921,1,"Mecklenburg, Middle-Brandenburg (Germany)",Fröde,1950
4921,1,Upper Bavaria (Germany),Vollmar,1947
4921,7,Lake Constance area (Germany),Winterhoff,n.n.
4921,4,"Black Forest, Neckar region (Germany)",Th. Müller,n.n.
4921,28,common throughout the whole Hungary,Soó 1964,1964
4921,n.n.,"Ponds and exposed banks of watercourses, canals, ditches, ponds and ponds in Departments Cher,  l'Eure-et-Loir, Indre, Indre-et-Loire, Loir-et-Cher, Loiret (France)    ",Pujol et al. 2023,n.n.
4921,1,Altmühl Valley (Germany),Runge,1975
4921,4,Upper Rhine area (Germany),Oberdorfer,1957
4921,5,Franconia (Germany),Korneck,n.n.
4921,17,Palatinate (Germany),Oesau,n.n.
4921,19,"Mecklenburg, Middle-Brandenburg (Germany)",Passarge,1959
4921,4,Upper Rhine region (Germany),Philippi,n.n.
4921,1,Main (Germany),Philippi,n.n.
4921,n.n.,"Annual vegetation of silted-up soils on the banks of the Petite Sauldre at Salbris (Departement Loir-et-Cher, France) in Sologne",Pujol et al. 2023,n.n.
4921,10,Swabian Alb (Germany),Th. Müller,n.n.
4921,12,Upper Rhine area (Germany),Th. Müller,1974
4921,1,Upper Bavaria (Germany),Oberdorfer,n.n.
4921,3,"Mecklenburg, Middle-Brandenburg (Germany)",Sukopp,1959
4922,12,West Mecklenburg (Germany),Passarge,1964
4922,5,northern Upper Rhine area (Germany),Philippi,1977
4922,14,"Brandenburg, East Mecklenburg (Germany)",Passarge,1959
4922,2,Baar (Germany),Görs,1968
4922,1,"Brandenburg, East Mecklenburg (Germany)",Hueck,1931
4922,75,lowland and colline areas across the Czech Republic,Chytry et al. 2011,1975/2011
4922,1,northern Upper Rhine area (Germany),Korneck,n.n.
4922,1,"Brandenburg, East Mecklenburg (Germany)",Passarge,1959
4922,1,Lower Bavaria (Germany),Oberdorfer,1957
4922,4,"Brandenburg, East Mecklenburg (Germany)",Sukopp,1959
4922,n.n.,"Forest ruts, banks of ponds, ponds, canals, ditches and watercourses in Departments Cher,  l'Eure-et-Loir, Indre, Indre-et-Loire, Loir-et-Cher, Loiret (France)    ",Pujol et al. 2023,n.n.
4922,2,Neckar area (Germany),Th. Müller,n.n.
4922,4,Swabian Alb (Germany),Th. Müller,n.n.
4922,1,Lake Constance area (Germany),G. Lang,n.n.
4923,28,common throughout the whole Hungary,Soó 1964,1964
4923,64,mainly in colline areas across the Czech Republic,Chytry et al. 2011,1975/2011
4924,35,"occurrences are concentrated to mid-altitude fishpond areas, while it is absent from dry lowlands and high mountain areas in the Czech Republic",Chytry et al. 2011,1975/2011
4925,28,common throughout the whole Hungary,Soó 1964,1964
4925,63,"most frequent in fishpond areas, but it is also common elsewhere at low to mid-altitudes in the Czech Republic",Chytry et al. 2011,1975/2011
4926,8,"Buda Hills, Bükk, Balaton region, Bakony, Vertes, Velencei-hegység, Gödöllő Hills, Cserhát (Hungary)",Soó 1964,1964
4926,89,from the lowlands to mountain areas of the Czech Republic,Chytry et al. 2009,1975/2009
4927,29,common in dry lowland and colline areas of the Czech Republic,Chytry et al. 2009,1975/2009
4928,28,in lowland and colline landscapes across the Czech Republic,Chytry et al. 2009,1975/2009
4928,73,"western and central Europe. In the Netherlands, especially in cities, with the exception of the northeast",Schaminée et al. 2010,2010
4929,144,In the Czech Republic this is one of the most common types of ruderal vegetation,Chytry et al. 2009,1975/2009
4930,3,"sporadically, so in the Mátra, on the outskirts of the Alföld, e.g. Agárd, Siófok (Hungary)",Soó 1964,1964
4930,1,Middle-Brandenburg (Germany),Schlüter,1955
4930,31,"Mecklenburg, Brandenburg and Elbe-Havelland (Germany)",Passarge,1959
4933,35,"northern, central and eastern Bohemia and southern Moravia (Česko)",Chytry et al. 2007,1975/2007
4934,1,Inland coast of Mönchgut (Rügen) (Germany),Polte,1996
4934,7,Nature Protected Area  push end moraine north of Remplin (Germany),Voigtländer,1996
4934,6,"Uckermärkisches Hügelland, East Rügen, Malchin Basin, riverbanks of Peene and Tollense, Oder region (Germany)",Dengler,2002
4934,5,Nature Protected Area  east bank of the Feisneck near Waren (Germany),Knapp and  Voigtländer,1983
4934,1,Nature Protected Area  Grünzer mountains (Germany),Schwarz et al.,1996
4934,5,"Uckermärkisches Hügelland, East Rügen, Malchin Basin, river edges of Peene and Tollense, Oder region (Germany)",AG Geobotanik Meck-Pomm,1995
4934,3,Swamp end moraine of the Malchin basin north of Remplin (Germany),Wollert,1979
4935,6,"Alsace (France), Palatinate, Upper Rhine area, Neckar area, Main-Tauber area, central and eastern Swabian Alb, Ries, Danube area, Hegau (Germany)",Hetzel and  Ullmann,1981
4935,3,Mecklenburg u. Brandenburg (Germany),Fröde,1958
4935,1,"Alsace (France), Palatinate, Upper Rhine area, Neckar area, Main-Tauber area, central and eastern Swabian Alb, Ries, Danube area, Hegau (Germany)",Görs,1966
4935,24,in warm lowland and colline areas of the Czech Republic,Chytry et al. 2009,1975/2009
4935,2,"Alsace (France), Palatinate, Upper Rhine area, Neckar area, Main-Tauber area, central and eastern Swabian Alb, Ries, Danube area, Hegau (Germany)",Brandes,1980
4935,3,"Alsace (France), Palatinate, Upper Rhine area, Neckar area, Main-Tauber area, central and eastern Swabian Alb, Ries, Danube area, Hegau (Germany)",Philippi,1971
4935,5,Mecklenburg and Brandenburg (Germany),Passarge,1964
4935,1,"Alsace (France), Palatinate, Upper Rhine area, Neckar area, Main-Tauber area, central and eastern Swabian Alb, Ries, Danube area, Hegau (Germany)",Lohmeyer,1957
4935,3,"Alsace (France), Palatinate, Upper Rhine area, Neckar area, Main-Tauber area, central and eastern Swabian Alb, Ries, Danube area, Hegau (Germany)",Oberdorfer,1957
4935,n.n.,"Départements Alpes-Maritimes, Alpes de Haute-Provence, Hautes-Alpes, Drome, Isére, Savoie, Haute-Savoie (France)",Julve ,2024
4935,10,"Alsace (France), Palatinate, Upper Rhine area, Neckar area, Main-Tauber area, central and eastern Swabian Alb, Ries, Danube area, Hegau (Germany)",Brandes,1977
4935,15,commonly spread throughout the whole Hungary,Soó 1964,1964
4935,41,"Alsace (France), Palatinate, Upper Rhine area, Neckar area, Main-Tauber area, central and eastern Swabian Alb, Ries, Danube area, Hegau (Germany)",Th. Müller,1972
4935,6,"Alsace (France), Palatinate, Upper Rhine area, Neckar area, Main-Tauber area, central and eastern Swabian Alb, Ries, Danube area, Hegau (Germany)",Th. Müller,n.n.
4935,4,"Alsace (France), Palatinate, Upper Rhine area, Neckar area, Main-Tauber area, central and eastern Swabian Alb, Ries, Danube area, Hegau (Germany)",Ullmann,1977
4935,n.n.,"Fallow land, embankments, rubble and other ruderal sites in Departement Cher (France)",Pujol et al. 2023,n.n.
4935,13,"Alsace (France), Palatinate, Upper Rhine area, Neckar area, Main-Tauber area, central and eastern Swabian Alb, Ries, Danube area, Hegau (Germany)",Oswald,1958
4935,5,"Alsace (France), Palatinate, Upper Rhine area, Neckar area, Main-Tauber area, central and eastern Swabian Alb, Ries, Danube area, Hegau (Germany)",Philippi,n.n.
4936,47,"central and western Europe. In the Netherlands restricted to the river area, the dunes south of Bergen (Renodunal district) and cities in the west of the country",Schaminée et al. 2010,2010
4936,8,in lowland and colline areas of the Czech Republic,Chytry et al. 2009,1975/2009
4937,100,initial stages of secondary succession in and around human settlements in the Czech Republic,Chytry et al. 2009,1975/2009
4937,12,South-East-Altmark and Berlin (Germany),Passarge,1964
4937,4,Magdeburg and Berlin (Germany),Passarge,1964
4938,15,commonly spread throughout the whole Hungary,Soó 1964,1964
4938,10,Brandenburg (Germany),Passarge,1959
4938,16,East-Mecklenburg and Brandenburg (Germany),Passarge,1964
4938,35,common in warm lowland and colline areas in the Czech Republic,Chytry et al. 2009,1975/2009
4938,8,North- and Middle-Mecklenburg (Germany),Passarge,1959
4938,n.n.,"Cities, villages and disturbed sites in an anthropogenic context in Departments Cher,  l'Eure-et-Loir, Indre, Indre-et-Loire, Loir-et-Cher, Loiret (France)    ",Pujol et al. 2023,n.n.
4938,2,North- and Middle-Mecklenburg (Germany),Fröde,1958
4938,n.n.,all French Regions except coast of Provence-Alpes (France),Julve ,2024
4939,20,commonly spread throughout the whole Hungary,Soó 1964,1964
4939,n.n.,"in semi-ruderal, pioneer scrubland in Departement Cher (France)",Pujol et al. 2023,n.n.
4939,135,common from lowland to submontane areas of the Czech Republic,Chytry et al. 2009,1975/2009
4939,32,"Mecklenburg, Altmark and West- and North-Brandenburg (Germany)",Passarge,1959
4940,n.n.,Medio-European France,Julve ,2024
4940,1,Mecklenburg (Germany),Fröde,1950
4940,162, throughout the Czech Republic from lowlands up to the montane belt (Česko),Chytry et al. 2007,1975/2007
4940,15,commonly spread throughout the whole Hungary,Soó 1964,1964
4940,48,"Mecklenburg, Brandenburg and Magdeburg district (Germany)",Passarge,1957
4940,n.n.,"Meadow entrances, paths and, more generally, places where livestock congregate in Departments Cher,  l'Eure-et-Loir, Indre, Indre-et-Loire, Loir-et-Cher, Loiret (France)    ",Pujol et al. 2023,n.n.
4940,4,East-Brandenburg and middle Elbe valley (Germany),Passarge,1957
4940,55,"widespread in large parts of the northern hemisphere, with a clear optimum in the lowlands. In the Netherlands, the association is very common in all districts.",Schaminée et al. 2010,2010
4940,n.n.,at Dhuizon in Sologne.,Pujol et al. 2023,n.n.
4941,n.n.,"Départements Aube, Marne, Ardennes, Nord, Pas-de-Calais, Somme (France)",Julve ,2024
4941,50,"southern Upper Rhine area, Swabian Alb, further Neckar area, Tauber valley (Main area) and Hegau region (Germany)",Th. Müller,1974
