Comm_ID,Account of relevés,Locations of relevés,Authors,Year of occurances
2465,11,"Franconian and Swabian Alb, southern hill country (Isteiner Klotz, Grenzacher Horn), Neckar and Lake Constance area (Germany)",Zimmermann,1982
2465,15,"Vogtland, Mulde-Lößhügelland, Osterzgebirge, Triebischtal, Nature Protected Area  Kemnitztal, Nature Protected Area  Triebtal, Nature Protected Area  Steinicht, Zschopautal south of Mittweida, Nature Protected Area  Trebnitzgrund (Germany)",Schmidt,n.n.
2470,3,Southwest Alb (Germany),Koch and  v. Gaisberg,1937
2470,7,Southwest Alb (Germany),Th. Müller,n.n.
2471,5,Allgäu Alps (Germany),Oberdorfer,1950
2471,6,Allgäu Alps (Germany),Th. Müller,n.n.
2471,24,"Rhine valley slope, Samina valley between Steg and Valorschbach (Liechtenstein) ",Schmider et Burnand 1988,1988
2472,6,Allgäu Alps (Germany),Th. Müller,n.n.
2472,5,Allgäu Alps (Germany),Oberdorfer,1950
2473,6,Allgäu Alps (Germany),Th. Müller,n.n.
2473,5,Allgäu Alps (Germany),Oberdorfer,1950
2474,75,Southwest-Alb (approximately from Hechingen to Spaichingen) (Germany),Th. Müller,1964
2475,4,Mainhardt Forest (Germany),Buck-Feucht,1962
2477,9,Welzheimer Forest (Germany),Rodi,1959
2478,218,"inner and interalpine, montane",Willner et Grabherr,n.n.
2501,n.n.,"European distribution area (dune sands, nutrient-poor rock in some low mountain ranges)",Runge,n.n.
2501,16,Wollin Island (Poland),Piotrowska,1955
2501,3,Comptureyer mountain near Wokuhl (Germany),Stegemann and  Doll,1976
2501,11,Darß (Germany),Fukarek,1961
2501,2,Island of Ruden (Germany),Jeschke,1968
2501,4,"North-Mecklenburg, Baltic Sea coast (Germany)",Meusel,1951
2501,3,Leba spit (Poland),Hueck,1932
2501,19,Darß (Germany),Libbert,1940
2501,2,Darß (Germany),Libbert,1940
2501,5,"North-Mecklenburg, Baltic coast (Germany)",Passarge,1968
2501,4,Island of Rügen (Germany),Meusel,1951
2501,8,Usedom  (Poland),Piotrowska,1955
2501,6,"North-Mecklenburg, Baltic coast (Germany)",Raabe,1944
2502,3,SW Mecklenburg (Germany),Passarge,1968
2502,n.n.,all of France except Alps ,Julve ,2024
2510,15,"Lower Bavaria (Ahrensberg, Sandharlanden, Siegenburg) (Germany)",Korneck,1974
2510,12,Upper Rhine plain (Mainz dryland) (Germany),Korneck,1974
2510,37,northern Upper Rhine plain (Schwetzinger Hardt) (Germany),Philippi,1970
2510,n.n.,"European distribution area (calcareous, surface acidifying sands))",Runge,n.n.
2510,5,"Lower Bavaria (Ahrensberg, Sandharlanden, Siegenburg) (Germany)",Rodi,1975
2510,5,"Bauland, Tauber area (Zimmern, Buchen, Kühlsheim, Wenkheim, Tauberbischofsheim) (Germany)",Oberdorfer,1957
2510,4,"Middle- Main area (Wiesetheid, Kitzingen, Ebrach) (Germany)",Zeidler and  Straub,1967
2511,19,"Sudeten (northeastern border of the Bohemian Basin/Germany, Czech Republic, Poland)",F. K. Hartmann,1959
2511,,"Velders Plan, Gsieser Tal, Rauth, Ulfas (Province South Tyrol, Italy)",AfF Südtirol,2010
2512,48,Kampinos heath near Warsaw (Poland),Kobendza,1930
2512,20,Vistula region near Plock (Poland),Dabrowski,1962
2512,21,Middle- Warta region (Poland),Preising,1962
2512,7,Coast of Mönchsgut (Island of Rügen) (Germany),Rösler,1997
2512,3,East coast of the Bodden (Germany),Paulson and  Raskin,1998
2512,5,Nature Protected Area  east bank of the Feisneck near Waren (Germany),Knapp and  Voigtländer,1983
2512,11,Surroundings of Warsaw (Poland),Juraszek,1928
2512,5,South-Masovia (Poland),Niedzialkowski,1929
2512,3,Thermal waste utilization plant Neubrandenburg (Germany),Wollert,1995
2512,24,Podlachia (Eastern Poland),Solokowski,1962
2512,24,Masuria (Poland),Steffen,1931
2512,14,Kurpien Land (North-Masovia) (Poland),Solokowski,1962
2512,12,Kampinos heath near Warsaw (Poland),Traczyk,1962
2512,6,W part of the Knyszyn Heath near Bialystok (Eastern Poland),Solokowski,1962
2512,3,Masuria (Poland),Preising,1962
2512,25,South-east-Polesia (Ukraine),Tschernogolowka and  a.,1962
2513,10,Lyck (Poland),Solokowski,1962
2513,27,Augustow heath (Poland),Dabrowski and  Czerwinski,1962
2513,1,Leppel (Belarus),Ellenberg,1942
2513,30,Lithuania,Preising,1962
2513,5,Latvia,Preising,1962
2513,4,NE Masuria (Poland),Ellenberg,1962
2513,15,Bialowieza virgin forest (Poland),Matuszkiewicz,1952
2513,7,East Masuria (Poland),Steffen,1931
2513,19,East Knyszyn Heath near Bialystok (Poland),Solokowski,1962
2513,15,Johannisburg heath (Poland),Traczyk,1962
2514,471,"Northwestern and Western Serbia, on Gučevo, Maljen, Cer, parts of Tara and Zlatibor, in submontane part of Kopaonik, on Pešter, Fruška Gora, on Vršačke mountains (Serbia, Montenegro)",Stajic 2024,2024
2514,65,Transsylvania (Romania),Donita et al. 2008,2007
2515,16,"Mountain ridge between Marecchia valley and Biscuvio-Candigliano valley, Apennines of Marche Region, Province of Pesaro-Urbino, Italy",Ubaldi & Speranza,1982
2516,n.n,"right along the Apennine chain from Emilia-Romagna to Calabria, in the sub-montaine and lower mountain belt",Blasi et al. ,2020
2516,20,"hills near Bologna, Italy",Ubaldi (in UBALDI 1995),1980
2517,n.n.,Département Alpes-Maritimes (France),Julve ,2024
2517,17,"Mount Rufeno, Province of Viterbo (Italy)",Scoppola et Filesi ,1995
2518,12,"chains of the Tyrrhenian side of central and southern Italy, sub-coastal environments on the Adriatic side of Italy, Murgia in Puglia",Blasi et al. ,2020
2518,n.n.,Département Alpes-Maritimes (France),Julve ,2024
2519,24,"central Apennines (Marches, Umbrian and Abruzzi regions), Fucino basin,  Aquilan plain, Capestrano hollow",Blasi et al. ,2020
2519,n.n.,"Départements Pyrénées-Orientales, Bouche du Rhone, Var, Alpes-Maritimes, Ardeche, Lozère (France)",Julve ,2024
2520,7,"sub-Apennine hills and coastal mountains (mainly in the Tyrrhennian district) within an area that extends from southern Tuscany to northern Campania and also includes small parts of the southern Marches, Abruzzo and Molise",Blasi et al. ,2020
2520,n.n.,"Départements Pyrénées-Orientales, Aude, Hérault, Gard, Vaucluse, Bouche du Rhone, Var, Alpes-Maritimes, Alpes de Haute-Provence, Drome, Ardeche, Lozere, Corse du Sud  (France)",Julve ,2024
2521,12,"Marittime Alps, the Apuane Alps and the Ligurian-Piedmont Apennines",Blasi et al. ,2020
2522,5,"right along the Apennine chain from Emilia-Romagna to Calabria, in the sub-montaine and lower mountain belt",Blasi et al. ,2020
2522,n.n,"Mountain ridge between Marecchia valley and Biscuvio-Candigliano valley, Apennines of Marche Region, Province of Pesaro-Urbino, Italy",Ubaldi & Speranza,1982
2523,60,"Calenzano, near the Volmiano Castle, Mt. Morello, Province of Florence, Italy",Arrigoni et al.,1997
2523,4,"chains of the Tyrrhenian side of central and southern Italy, sub-coastal environments on the Adriatic side of Italy, Murgia in Puglia",Blasi et al. ,2020
2524,8,"sub-Apennine hills and coastal mountains (mainly in the Tyrrhennian district) within an area that extends from southern Tuscany to northern Campania and also includes small parts of the southern Marches, Abruzzo and Molise",Blasi et al. ,2020
2524,23,"Province of Grosseto, Italy; Scansano, south of the Poggioferro-Murci road",Arrigoni et al.,1990
2525,8,"sub-Apennine hills and coastal mountains (mainly in the Tyrrhennian district) within an area that extends from southern Tuscany to northern Campania and also includes small parts of the southern Marches, Abruzzo and Molise",Blasi et al. ,2020
2526,4,"Mt. Rufeno, Province of Viterbo, Italy",Scoppola et Filesi ,1998
2526,18,"sub-Apennine hills and coastal mountains (mainly in the Tyrrhennian district) within an area that extends from southern Tuscany to northern Campania and also includes small parts of the southern Marches, Abruzzo and Molise",Blasi et al. ,2020
2527,10,Tuscana Italy,Blasi et al. ,2020
2527,3,"Province of Grosseto, Italy; Civitella Paganico",Arrigoni et al.,1990
2528,11,"sub-Apennine hills and coastal mountains (mainly in the Tyrrhennian district) within an area that extends from southern Tuscany to northern Campania and also includes small parts of the southern Marches, Abruzzo and Molise",Blasi et al. ,2020
2528,20,"Farnetta, Umbria Region, Provinces of Perugia and Terni, Italy; ",Biondi et al.,2001
2529,26,"""Iron Gate"" (South-western egde of Romania) ",Donita et al. 2008,2007
2529,8,"sub-Apennine hills and coastal mountains (mainly in the Tyrrhennian district) within an area that extends from southern Tuscany to northern Campania and also includes small parts of the southern Marches, Abruzzo and Molise",Blasi et al. ,2020
2529,33,"Mt. Soratte, Lazio Region, Ialy",Blasi,1984
2530,7,"sub-Apennine hills and coastal mountains (mainly in the Tyrrhennian district) within an area that extends from southern Tuscany to northern Campania and also includes small parts of the southern Marches, Abruzzo and Molise",Blasi et al. ,2020
2530,4,"Northwestern Latium, Italy",Blasi,1984
2531,5,"sub-Apennine hills and coastal mountains (mainly in the Tyrrhennian district) within an area that extends from southern Tuscany to northern Campania and also includes small parts of the southern Marches, Abruzzo and Molise",Blasi et al. ,2020
2531,2,"Caldara di Manziana, Lazio Region, Italy",Biondi et al.,1998
2532,17,"southern Campania, Basilicata and Calabria, with localised occurrences in northern Campania, Molise and Apulia",Blasi et al. ,2020
2532,30,"Lucane Apennines, Italy; valico Sella Lata, along the road from Laurenzana to Corleto Perticara, Province of Potenza, Italy;",Aita et al. ,1977
2533,27,"Lucano Apennines between the Basento and Agri valleys; between Tramutola and Grumento, Province of Potenza (Italy)",Zanotti et al. ,1995
2533,9,"southern Campania, Basilicata and Calabria, with localised occurrences in northern Campania, Molise and Apulia",Blasi et al. ,2020
2534,8,"southern Campania, Basilicata and Calabria, with localised occurrences in northern Campania, Molise and Apulia",Blasi et al. ,2020
2534,2,"area between Grottole and Grassano, Province of Matera, Lucane Apennines, Italy",Zanotti et al. ,1995
2535,4,"southern Campania, Basilicata and Calabria, with localised occurrences in northern Campania, Molise and Apulia",Blasi et al. ,2020
2535,152,"Dolomiti Lucane (Accettura, Oliveto Lucano and San Mauro Forte), Province of Potenza, Italy",Bonin & Gamisans,1976
2536,137,"Calvello, Province of Potenza, Basilicata Region, and Campana and Savelli (Sila) in Province of Crotone (Italy)",Bonin & Gamisans,1976
2536,12,"southern Campania, Basilicata and Calabria, with localised occurrences in northern Campania, Molise and Apulia",Blasi et al. ,2020
2537,20,"southern Campania, Basilicata and Calabria, with localised occurrences in northern Campania, Molise and Apulia",Blasi et al. ,2020
2537,17,"Campobasso and Mt. Farneta, near Felitto (Salerno) (Italy)",Blasi et Paura ,1995
2538,29,"Epirus: near Konitsa, Timﬁ, Valaoritis;  Macedonia: Voras, Paiko, Chasia; Thessaly: Kato Olimbos; Rodopi; Thrace",Bergmeier ,2008
2539,10,Lower Olympos (Greece),Bergmeier 1990,1984
2539,41,"Macedonia: Voras, Paiko, Chasia; Macedonia: Pieria; Thessaly: Kato Olimbos; Epirus: Timﬁ",Bergmeier ,2008
2540,6,Lower Olympos (Greece),Bergmeier 1990,1984
2540,43,"Epirus: near Konitsa; Macedonia: Voras, Chasia; Macedonia: Rodopi, Athos; Thessaly: Kato Olimbos, Ossa.",Bergmeier ,2008
2541,90,"Thessaly: Kato Olimbos, Ossa; Macedonia: Voras, Paiko, Krousia (Disoro); Kerdilio, Cholomon, Chalkidiki, Rodopi; Thrace",Bergmeier ,2008
2542,31,"Macedonia: Voio; Pieria; Thessaly: Kato Olimbos, Ossa, Mavrovouni, Pilio; Rodopi, Chalkidiki, Athos",Bergmeier ,2008
2543,12,Peloponnisos: Parnon,Bergmeier ,2008
2544,15,Crete,Bergmeier ,2008
2545,47,Macedonia and Thrace: Rodopi,Bergmeier ,2008
2546,111,"Epirus: near Konitsa, Valaoritis, Tsoumerka; Macedonia: between Kastoria and Florina, Chasia; Paiko, Voras, Pieria",Bergmeier ,2008
2547,10,Lower Olympos (Greece),Bergmeier 1990,1984
2547,26,"Thessaly and adjacent Macedonia: Pilio, Mavrovouni, Kato Olimbos",Bergmeier ,2008
2548,74,"Macedonia: Cholomon (Chalkidiki), Kerdilio, Kilkis",Bergmeier ,2008
2549,14,Peloponnisos: Parnon,Bergmeier ,2008
2550,59,Peloponnisos: Foloi (Ilía),Bergmeier ,2008
2551,5,Highlands of Castilla and Aragón (Maestrazgo) (Spain),Loidi et Herrera,1990
2552,21,Highlands of Castilla and Aragón (Maestrazgo) (Spain),Loidi et Herrera,1990
2552,5,"Ladera del Crucero, Valdelateja; Valle de Sedano - Gredilla de Sedano: Orbaneja del Castillo, Umbrí­a Arroyo de de Fuente Hernando, Manantial de la Pila, Alrededores del Balneario de Valdelateja, Umbrí­a del Arroyo de Bozas, Sargentes de la Lora, Umbría A",Alvarez et al. ,2008
2553,12,Highlands of Castilla and Aragón (Maestrazgo); Vitoria-Gasteiz (Spain),Loidi et Herrera,1990
2554,2,"Sedanotal, City of Huidobro, Combe de Huidobro up to La Mesa and El Crucero (Spain)",Alvarez et al. ,2008
2555,1,"Valle de Huidobro, Los Altos (Spain)",Alvarez et al. ,2008
2556,5,"El Topo, Orbaneja del Castillo; Las Carrascas, Páramo de la Lora, Valle de Sedano; Las Carrascas, Páramo de la Lora, Valle de Sedano; Solana del Alto de Alcidón, Pesquera de Ebro; Entre Pesquera de Ebro y Cubillo de Butrón (Spain)",Alvarez et al. ,2008
2557,1,"Farallones y roquedos en Las Calzadas, apretura del río Ebro, Pesquera de Ebro (Spain)",Alvarez et al. ,2008
2558,2,"Río Ebro, Pesquera de Ebro (Spain)",Alvarez et al. ,2008
2559,5,along the road from Cogoleto to Sciaborrasca (province of Genoa); Serra mountain (province of Pisa); Vicopisano (province of Pisa) (Italy),Biondi et Vagge ,1999-2005
2560,5,"Cavi Lavagna (province of Genoa); Mattarana (province of La Spezia); Nero mountain (Rocchetta Vara, province of La Spezia); Rocchetta Vara (province of La Spezia); Serra mountain (province of Pisa) (Italy)",Biondi et Vagge ,2001-2003
2560,5,Promontorio Portoﬁno (province of Genoa) (Italy),Gentile et al. ,2004
2561,4,Bargone - M. S. Antonio (province of Genoa); Zerli – Miniere Gambatesa (province of Genoa),Biondi et Vagge ,2001
2562,6,Alcanizano-Gandesan,Cano et al. ,2022
2563,15,"Setabensean sector in the Allorano Cofrentino, Huertano Valenciano Turiano, Alcoyano Dianense, Yeclano Villenensean districts (Valenciana-Provenzal-Balearic province)",Cano et al. ,2022
2564,15,"Cincovillés, Zaragozano Estepario, and Somontano Aragonés districts in the Somontano sector; and in the Mone-grino district in the Bardenero Monegrino sector, occasionally extending to the Alcañizano district",Cano et al. ,2022
2565,15,"Zaragozano Estepario and Belchitano Hijarensean districts in the Bardenero-Monegrino sector, but may occasionally extend into the Bilbilitano-Serrano Cucalonensean district in the Northern Oroiberian sector",Cano et al. ,2022
2566,16,"Cerro del Alcor de la Nava de San Luis (Malaga), Sierra del Pinar de Grazalema (Cadiz), Benamahoma, Sierra del Pinar de Grazalema (Cadiz), Tajo de los Lagares, Sierra de Yunquera (Malaga), Los Reales, Sierra Bermeja de Estepona (Malaga) (Spain)",Asensi et Rivas-Martinez ,1976
2567,10,Sierra de Cazorla,Cano et al. ,2022
2568,9,"Manchuela Conquense, Manchego sector, Serrano Espunense and Jumillano Hellinense district (Manchego sector), and the Allorano Cofrentino district in the Setabensean sector.",Cano et al. ,2022
2569,9,"Sierra de Gador (Gadorensean district, Alpujarreño-Gadorensean sector, Betic province) and in the Western Almeriensean and Serrano-Alhamillensean dis-tricts in the Murciano-Almeriensean province",Cano et al. ,2022
2570,20,"island of Majorca and Menorca, Ibiza and Formentera, Region de Murcia",Cano et al. ,2022
2571,10,"Caldeirao Mountains, Monchique Sierran District",Quinto Canas et al. ,2021
2572,10,Mediterranean-Iberoatlantic,Quinto Canas et al. ,2021
2573,4,"Bética Province, reaching the Algarve and Monchique Sector, Cádiz and Sado Subprovince",Quinto Canas et al. ,2021
2574,7,Lusitania and Extremadura Subprovince,Quinto Canas et al. ,2021
2575,1,Cerezo de arriba (La Pinilla) (Spain),Vilches de la Serna et al. ,2016
2576,5," Riaza, Villarejo (Sto. Tome´ del puerto), Cerezo de Arriba (Segovia), Embalse de Becerril de la Sierra, Miraflores de la Sierra (Madrid), (Spain)",Vilches de la Serna et al. ,2016
2577,2," Navamorcuende (Toledo), Barranco “Casa Forestal Las Juntas” (Spain)",Vilches de la Serna et al. ,2016
2578,16," Munotelo, Mengamunoz , Nava del Barco, Tremedal, Navacepedilla de Corneja, Villafranca de la Sierra, Piedrahita de la Sierra, Serranillos, Zapardiel de la  Ribera, Navacepeda  de  Tormes, Navamojada, Navamures, La Lastra del Cano, Gil Garcia,  Navalongui",Vilches de la Serna et al. ,2016
2578,1,Bejar (Salamanca) (Spain),Vilches de la Serna et al. ,2016
2579,6," Navasfrías, El Payo, La Alberca, Piornal, Sequeros, Casafranca,  (Spain)",Vilches de la Serna et al. ,2016
2580,13,"Salto de Villarino,  El Milano, Aldeavilla de la Ribera, El Maillo, Villasbuenas, Barruecopardo, El Payo, Villasrrubias, Casillas de flores, Alberguería de Arganán, Linares de Riofrío, Cristobal  (Spain)",Vilches de la Serna et al. ,2016
2581,6,"El Hornillo, Guisando, Arenas de San Pedro,Candeleda, La Adrada, Casavieja (Ávila)(Spain)",Vilches de la Serna et al. ,2016
2581,8,"Garcibuey (Salamanca), Mogarraz (Salamanca), Villanueva del Conde (Salamanca), Las Casas del Conde (Salamanca), Miranda del Castaar (Salamanca), Sotoserrano (Salamanca), Herguijuelo de la Sierra (Salamanca), Valero de la Sierra (Salamanca)",Vilches de la Serna et al. ,2016
2581,1,Real de San Vicente (Toledo) (Spain),Vilches de la Serna et al. ,2016
2581,10,"Jaraiz de la Vera, Barrado, Hervás, Navaconejo, El Torno, Villanueva de la Sierra, Hoyos, San Martín de Trevejo, Villamiel (Cáceres) (Spain)",Vilches de la Serna et al. ,2016
2582,3,Moiola (Italy),Vagge et Biondi,2000
2582,4,Valdieri (Italy),Vagge et Biondi,2000
2582,1,Valle dell’ Ubaye (France),Vagge et Biondi,2005
2582,n.n.,Départements Hautes-Alpes (France),Julve ,2024
2582,2,Clue de Barle (France),Vagge et Biondi,2005
2583,1,Port de Barry/Trois bees de Saou (France),Barbero et Quezel,1986
2583,1,Peyresc (France),Barbero et Quezel,1986
2583,1,Morgon à Blache de Donnadieu (France),Barbero et Quezel,1986
2583,1,Saint-Clement (France),Barbero et Quezel,1986
2583,1,Boulc (Vercors) ,Barbero et Quezel,1986
2583,1,Col di Tenda  (Italy),Barbero et Quezel,1986
2583,1,Valle du Bes-Pie de l’Aiguille (France),Barbero et Quezel,1986
2583,1,Moviola  (Italy),Barbero et Quezel,1986
2583,1,Thorame Haute (Verdon) (France),Barbero et Quezel,1986
2583,1,Valle de la Galere  (Italy),Barbero et Quezel,1986
2583,1,Clue de Barles à l’Est  (France),Barbero et Quezel,1986
2583,1,Saint-Crepin (France),Barbero et Quezel,1986
2583,1,La royeres a Thorame Haute (France),Barbero et Quezel,1986
2583,1,Vallon de Mollieres (France),Barbero et Quezel,1986
2584,33,riparian formations of the Gallurese (NE Sardinia) and the Sulcitano-Iglesiente (SW Sardinia),Sciandrello et al. ,2022
2585,11,Sa Pruna in territory of Dorgali (CE Sardinia),Sciandrello et al. ,2022
2586,21,"Gennargentu massif (CE Sardinia), valleys of Monte Capanne on the Island of Elba and on Island of Giglio",Sciandrello et al. ,2022
2587,26,"Tyrrhenian side of central Italy (Monte Pisano, Poggio di Montieri, hills around the Farma-Merse basin and Monte Leoni and in Apuan Alps, also in northern Latium",Sciandrello et al. ,2022
2588,15,"Bergama-Kozak, Aydýn-Koçarlý, Antalya-Side, around the Marmara sea, the coast of Gemlik gulf and  Karadeniz region",Varol et Tel ,2010
2591,12,north Velebit (Kroatia),Anic,1957
2592,7,"Certainly present in the Cher department on the hills and slopes of the Boischaut Sud, Champagne Berrichonne, Cher valley and Sancerrois, as well as in the Indre department in the Creuse valley and in the Loir-et-Cher department in the Beauce.",Pujol et al. 2023,n.n.
2593,6,"Plateaux and gentle slopes in Departments Cher,  l'Eure-et-Loir, Indre, Indre-et-Loire, Loir-et-Cher, Loiret (France). Central-western France",Pujol et al. 2023,n.n.
2594,6,"Sologne, Puisaye, Boischaud Sud, Champagne Berrichone, Vallée de Germiny and Forêt d'Orléans. West-central France",Pujol et al. 2023,n.n.
2595,1,Occasional Solognot group (Vouzon Forest),Pujol et al. 2023,n.n.
2596,4,"Plateaux and slopes. Found in Pays-Fort, Sancerrois, Marche and Perche (France)",Pujol et al. 2023,n.n.
2597,6,"Valleys, depressions on plateaux and alluvial terraces. Outside the Beech's potential range. Central-western France. Very common in the Val de Loire",Pujol et al. 2023,n.n.
2598,n.n.,Northwest France,Dierschke et Bohn 2004,2004
2598,4,"Plateaux and slopes. Present over a wide area of western France. Present in the hilly areas of the Val de Loire: Marche, Boischaut Sud, Pays-Fort and Perche",Pujol et al. 2023,n.n.
2599,5,"Plateaux and slopes. West-central France. Found in the Sancerrois (Veaugues sector), Champagne Berrichonne (Meillant forest and surrounding area), Gâtinais (Montargis forest) and the Loire Valley (Russy forest)",Pujol et al. 2023,n.n.
2601,1,Velka hora Mountain near Karlstein (Central Bohemian Karst Region/Czech Republic),Zólyomi,n.n.
2601,5,Javorka (Central Bohemian Karst region/Czech Republic),Klika,1942
2601,1,Kralovskou Studni (Central Bohemian Karst region/Czech Republic),Klika,1942
2601,1,between Velka hora Mountain near Karlstein and Srbske (Central Bohemian Karst Region/Czech Republic),Klika,1942
2601,13,Velka hora mountain near Karlstein (Central Bohemian Karst region/Czech Republic),Klika,1942
2601,1,Karlstein (Central Bohemian Karst Region/Czech Republic),"Jakucs, Stieber",n.n.
2601,13,"Bohemian Karst, Ceske stfedohofi, hilly landscapes along the Labe river (Česko)",Chytry et al. 2013,1975/2013
2601,1,Doutnác Mountain (Central Bohemian Karst Region/Czech Republic),"Jakucs, Zólyomi, Tallós",n.n.
2601,2,Velka hora Mountain near Karlstein (Central Bohemian Karst Region/Czech Republic),"Jakucs, Zólyomi, Tallós",n.n.
2602,1,Felnémet (Bükk Mountains/Hungary),"Futák, Zólyomi, Jakucs",1957
2602,2,Oszoly (Buda Mountains/Hungary),"Jakucs, Fekete",1956
2602,3,"Turulhegy, Vereshegy, Pesköhegy (Gerecse Mountains/Hungary)","Jakucs, Fekete",1957
2602,1,Oszoly (Buda Mountains/Hungary),Zólyomi,1941
2602,1,Hársbokorhegy (Buda Mountains/Hungary),Zólyomi,1947
2602,1,Kétágúhegy (Buda Mountains/Hungary),Horánszky,1955
2602,2,Pelsöcer Mountain (Torna Karst/Hungary),"Jakucs, Fekete, Michalkó",1956
2602,1,Nitra: Zobor-hegy (Nitra/Hungary),"Jakucs, Fekete, Michalkó",1956
2602,1,Kiskevély (Buda Mountains/Hungary),"Jakucs, Fekete",1956
2602,1,Pilishegy (Buda Mountains/Hungary),"Jakucs, Fekete",1956
2602,2,Pilis (Buda Mountains/Hungary),Stieber,1952
2602,1,Hársbokorhegy (Buda Mountains/Hungary),Zólyomi,1940
2602,1,Bélkö (Bükk Mountains/Hungary),"Zólyomi, Jakucs, Fekete",1955
2602,1,Feketelen (Bükk Mountains/Hungary),"Zólyomi, Jakucs, Fekete",1953
2602,1,Várhegy (Bükk Mountains/Hungary),"Zólyomi, Jakucs, Baráth",1955
2602,1,Kisremetehegy (Buda Mountains/Hungary),Zólyomi,1947
2602,2,Sokol (Vihorlát/Hungary),Michalkó,1957
2602,8,Middle- Hernád Area (Hungary),Jurko,1951
2602,2,Krivoscanka (Vihorlát/Hungary),Michalkó,1957
2602,2,Hosszúhegy (Buda Mountains/Hungary),Horánszky,1955
2602,10,"Budai-hegy­ség, Pilis, Gerecse, Bükk, Cserhat, Naszaly, Tornai Karszt, Közép-Hernád vidék, Vihorlát, Nyitránál (Hungary)",Soó 1964,1964
2602,4,Szarvaskö (Bükk Mountains/Hungary),"Jakucs, Fekete",1955
2602,1,Alsóhámor (Bükk Mountains/Hungary),"Jakucs, Fekete",1955
2602,1,Bélkö (Bükk Mountains/Hungary),"Jakucs, Fekete",1955
2602,3,Nagyeged (Bükk Mountains/Hungary),"Jakucs, Fekete",1955
2602,1,Kerekhegy (Bükk Mountains/Hungary),"Jakucs, Fekete",1955
2602,2,"Nagypisznice, Törökös (Gerecse Mountains/Hungary)",Stieber,1951
2602,1,Garadna (Bükk Mountains/Hungary),Horánszky,1955
2602,5,Nádaska: Alsóhegy (Torna Karst/Hungary),Jakucs,1955
2602,3,Nagyoldal (Torna Karst/Hungary),Jakucs,1955
2602,1,Jósvafö: Nagyoldal (Torna Karst/Hungary),Jakucs,1954
2602,1,Jósvafö: Tohonya (Torna Karst/Hungary),Jakucs,1955
2602,1,Malevieska (Middle- Hernád Area/Hungary),"Jakucs, Fekete, Michalkó",1956
2602,1,Jablonov: Felsö Mountain (Torna Karst/Hungary),"Jakucs, Fekete, Michalkó",1956
2602,1,Konjart Plateau (Torna Karst/Hungary),"Jakucs, Fekete, Michalkó",1956
2602,2,Remetehegy (Buda Mountains/Hungary),"Jakucs, Fekete, Zólyomi",1955
2602,1,Somoder Plateau (Torna Karst/Hungary),"Jakucs, Fekete, Michalkó",1956
2603,1,Pálava Mountain: Devin (South Moravia/Czech Republic),Zlatnik,1954
2603,1,Moravian Karst (north of Brno/Czech Republic),"Jakucs, Zólyomi",1958
2603,1,Pausram Mountain (southern Moravia/Czech Republic),"Jakucs, Zólyomi",1958
2603,1,Moravian Karst: Purkyne (north of Brno/Czech Republic),Zlatnik,1958
2603,1,Pálava Mountain (South Moravia/Czech Republic),"Jakucs, Zólyomi",1958
2604,1,Klanác (Szentendre-Visegrád Mountains/Hungary),Horánszky,1956
2604,1,Nyergeshegy (Szentendre-Visegráder Gebirge/Hungary),Horánszky,1953
2604,1,Mátra: Hegyeshegy (Mátra-Börzsöny Mountains/Hungary),"Adamis, Horánszky",1959
2604,2,Köhegy (Szentendre-Visegrád Mountains/Hungary),Horánszky,1955
2604,1,Perseg (Szentendre-Visegrád Mountains/Hungary),Horánszky,1955
2604,2,Nyergeshegy (Szentendre-Visegráder Mountains/Hungary),Horánszky,1955
2604,1,Dobogóhegy (Szentendre-Visegráder Gebirge/Hungary),Horánszky,1955
2604,2,Vaskapuhegy (Szentendre-Visegráder Gebirge/Hungary),Horánszky,1955
2604,1,Tölgyeshegy (Szentendre-Visegráder Mountains/Hungary),Horánszky,1955
2604,1,Málnás (Szentendre-Visegráder Gebirge/Hungary),Horánszky,1955
2604,3,Vérteshegy (Szentendre-Visegráder Gebirge/Hungary),Horánszky,1955
2604,1,Hideglelöshegy (Szentendre-Visegráder Gebirge/Hungary),Horánszky,1954
2604,1,Mátra: Pipishegy (Mátra-Börzsöny Mountains/Hungary),Adamis,1959
2604,1,Macskalyuk (Szentendre-Visegráder Gebirge/Hungary),Horánszky,1955
2604,1,Mátra: Hegyeshegy (Mátra-Börzsöny Mountains/Hungary),Adamis,1959
2604,1,Mátra: Hosszúhegy (Mátra-Börzsöny Mountains/Hungary),Adamis,1959
2604,2,Aranyosi Valley (Sátor-Mountains/Hungary),Horánszky,n.n.
