Comm_ID	Account of relevés	Locations of relevés	Authors	Year of occurances
2055		Along the rivers of the Po Valley, sometimes in the lower valleys of the Alpine valleys (Valle Chisone, Germanasca, Pellice and Stura di Demonte) and in the hilly valley bottoms (Tanaro River) (Italy)	Camerano et al. 2008	2008
2055	27	along large lowland rivers at altitudes up to 335 m (Česko)	Chytry et al. 2013	1975/2013
2055	4	lower Inn valley (Germany)	Conrad	n.n.
2055	13	Lower Inn Valley (Germany)	Conrad	n.n.
2055	11	Lower Inn Valley (Germany)	Conrad	n.n.
2055	9	Lower Inn Valley (Germany)	Conrad	n.n.
2055	16	lower Inn valley (Germany)	Conrad	n.n.
2055		Romania: in the floodplains of large rivers (Prut, Siret, Olt, Jiu, Mureș, Someș)	Donita et al. 2005	1990-1992
2055		Romania: all in southern Romania, in the floodplains of the Danube's tributaries, Danube delta and in the Danube floodplain, in Lunca	Donita et al. 2005	1990-2001
2055	1	along the river Steyr and Zufbringer (Upper Austria)	Fischer	1997
2055	3	Swiss Jura (Aarau) Switzerland	Heller	1963
2055	1	Elbe and Oder floodplain (Germany)	Hueck	1931
2055	3	Salzach floodplains in Flachgau and Tennengau (Salzburg)	Jelem	1965
2055	18	west Danube floodplains, Tullnerfeld and Wachau, Marchfeld and Korneuburger mountains (Austria)	Jelem	1974
2055	18	Marchauen (Lower Austria)	Jelem	1975
2055	2	Manhartsberg (Austria)	Jelem	1976
2055	n.n.	Paris Basin  (France)	Julve 	2024
2055	1	Alpenostrand (Austria)	Knapp	1944
2055	1	Inn floodplains near Braunau (Austria)	Krammer	1953
2055	6	Lake Constance (Germany)	Lang	1973
2055	1	Lake Constance (Germany)	Lang	n.n.
2055	6	Riverine forests along the Leitha (Austria)	Lazowski	1989
2055	10	Isar estuary (Germany)	Linhard	1963
2055	7	Isar estuary (Germany)	Linhard	1963
2055	19	Lower Inn Valley (Germany)	Linhard	n.n.
2055	4	Danube floodplain near Ingolstadt (Germany)	Lohmeyer	n.n.
2055	6	Taubergießen (Upper Rhine) (Germany)	Lohmeyer, Trautmann	1974
2055	3	Danube floodplains, upper Lobau (Austria)	Margl	1973
2055	7	surroundings of Pulawi (Poland)	Matuszkiewicz	1956
2055	1	Stopfenreuter Au (Austria)	Miletich	1996
2055	20	Swiss Jura (Aarau) Switzerland	Moor	1958
2055	11	Württemberg Uplands (Germany)	Müller	n.n.
2055	6	Württemberg Uplands (Germany)	Müller	n.n.
2055	7	Illertal (Germany)	Müller, Görs	1958
2055	12	Illertal (Germany)	Müller, Görs	1958
2055	29	Growth districts: 2 Southern Hochösling, 3 Obersauer-, Wiltz-, Clierf- and Bleestal, 4 Ourtal, 5 Growth districts Ösling foreland, 7 Stegener Gutland, 8 Alzette-, Attert- and Mittelsauer valley, 9 Unter-sauertal, 10 Eisch-Mamer-Gutland, 11 Schooffielser a	Niemeyer et al. 2010	2010
2055	6	Upper Rhine Valley (Germany)	Oberdorfer	1957
2055		Tecuci plain (Romania)	Oprea 2004	2004
2055		Tecuci plain (Romania)	Oprea 2004	2004
2055	8	Elbe and Oder floodplain (Germany)	Passarge	1955
2055	18	Old Rhine near Karlsruhe (Germany)	Philippi	1978
2055	3	Altrhein near Karlsruhe (Germany)	Philippi	1980
2055		Po plain (Italy)	Poldini et al. 2020	2020
2055	n.n	Banks of watercourses and hydraulic appendages subject to heavy flooding and high tides, but sheltered from currents in Departments Cher,  l'Eure-et-Loir, Indre, Indre-et-Loire, Loir-et-Cher, Loiret (France)    	Pujol et al. 2023	n.n.
2055	n.n	installed in a backwater of the Cher at Villeneuve-sur-Cher (Departement Cher, France).	Pujol et al. 2023	n.n.
2055	1	Riverine forests of the alpine foothills of Lower Austria	Rauscher	1990
2055	9	Tyrolean Achen estuary (Austria)	Schauer	n.n.
2055	n.n.	Spree valley south of Bautzen, along the Neisse river (Germany)	Schmidt	n.n.
2055	7	Salach floodplain (Germany)	Schubert	n.n.
2055	2	Isar valley north of Munich (Germany)	Seibert	1962
2055	1	Isar valley north of Munich (Germany)	Seibert	1962
2055	6	Isar valley north of Munich (Germany)	Seibert	1962
2055	4	Rott valley near Ruhstorf (Germany)	Seibert	n.n.
2055	1	Danube floodplain near Neuburg (Germany)	Seibert	n.n.
2055	2	Ammer estuary (Germany)	Seibert	n.n.
2055	5	Danube floodplain near Neuburg (Germany)	Seibert	n.n.
2055	2	Loisachtal (Germany)	Seibert, Conrad	n.n.
2055	14	Szigetköz, Szentendrei-sziget, Budapest-Mohács, Kisalföld, Eszaki Alföld, Tokaj-Polgár, Szolnok-Szeged, Tiszafüred, Bakonyalja  (Hungary)	Soó 1964	1964
2055	7	Alzauen, Upper Bavaria (Germany)	Stangl	n.n.
2055	4	Alzauen, Upper Bavaria (Germany)	Stangl	n.n.
2055	3	Linz/Danube (Austria)	Stockhammer	1964
2055	2	am Giessgang in the Danube floodplains between Altenwörth and Korneuburg (Austria)	Straka	1992
2055	1	Dnister valley (Poland)	Szafer	1935
2055	2	River valleys (Elbe, Ems, etc.), Atlantic lowlands (Germany)	Tüxen	1937
2055		Dniester and Prut rivers and their tributaries (Republic Moldova)	Ungureanu et al.	2017
2055	20	Danube floodplains near Wallsee (Austria)	Wendelberger-Zelinka	1952
2055	9	Danube floodplains between Regensburg and Straubing (Germany)	Zahlheimer	1979
2056	8	Surroundings of Stettin (Poland)	Celinski	1958
2056	56	mainly on waterlogged sites near fishponds and in terrestrializing ox-bows at lower and middle altitudes (Česko)	Chytry et al. 2013	1975/2013
2056	619	mesotrophic carrs (France, Belgie, Netherlands, Poland, Czech Rep., Slovakia, Germany, Italy, Spain, greece, Romania, Croatia, Ukraine)	Douda et al. 2015 	n.n.
2056	1	Midlands of Switzerland	Etter et Morier-Genoud	1963
2056	3	Midlands of Switzerland	J.L. Richard in Ellenberg et Klötzli 1972	1966
2056		 in marshy depressions on river plains and in spring areas and on the very wet terraces of small streams in Belgium	Jaquemart et Deschamps 2025	2025
2056	n.n.	Medio-European France	Julve 	2024
2056	11	Midlands of Switzerland	Klötzli 	1967
2056	1	Midlands of Switzerland	Kuhn et Zeller in Ellenberg et Klötzli 1972	1966
2056	n.n.	near Kartuzy (NW Poland near Gdansk)	Langguth, Kopp and  Passarge	1961
2056	12	Growth districts: 1 Northern Hochösling, 3 Obersauer-, Wiltz-, Clierf-, and Bleestal, 7 Stegener Gutland, 10 Eisch-Mamer-Gutland and 14 Pafebierger and Oetringer Gutland (Luxembourg)	Niemeyer et al. 2010	2010
2056	1	County Fürstenfeldbruck in the foothills of the Alps	Pfadenhauer	1969
2056	3	Landsberg district in the foothills of the Alps	Pfadenhauer	1969
2056	6	County Weilheim in the foothills of the Alps	Pfadenhauer	1969
2056	7	Island of Wollin(Poland)	Piotrowska	1955
2056	12	Dübener Heide, area of the Upper Lusatian hill country threshold/gravel zone, Neukollm, Grüngräbchen alder quarry Nature Protected Area , Dubringer Moor Nature Protected Area , quarry forest near AltmanNature Protected Area rün/Vogtland (Germany)	Schmidt	n.n.
2056	6	Közephegyseg: Sator-hegyseg, Dunántúl: őrség, Vend-vidék, Somogy, Alöld: Hanság, Beregi-sik (Hungary)	Soó 1964	
2056	13	North-West-Dtschl. lowlands (humid lowlands) (Germany)	Tüxen	1937
2056	1	Rosenheim County in the foothills of the Alps	W. Braun	1969
2057		on the Darß (Germany)	Hofmann et Pommer 2013 	2013
2057	5	Upper Palatinate Jura (Germany)	Rosskopf	1971
2057	21	Ore Mountains, upper Vogtland, near Mittelsaida (Germany)	Schmidt	n.n.
2058	4	Upland moors of the southern Black Forest: Eschengrundmoos, Unter-Ibacher Moor, Horbacher Moor, Föhrenmoos near Unter-Ibach (Germany)	A. Schumacher	1937
2058	3	Black Forest (Germany)	Bartsch	1940
2058	1	Kessler moss near Erlenbruck (Germany)	Bartsch	1940
2058	1	Border zone of the Hirschenmoor near Hinterzarten (Germany)	Bartsch	1940
2058	1	Great Muhr near Untersmatt (Germany)	Bartsch	1940
2058	1	Hinterzarten mire (Germany)	Bartsch	1940
2058	1	Swiss Jura, northern marginal Alps and central Alps (Switzerland)	Braun-Blanquet, Pallmann et Bach	1954
2058		mountain valley (polonyna) Hitanka in the Ivano-Frankivsk region at more than 1500 m a.s.l. (Ukraine)	Budzhak et al. 2016	2016
2058		mountain valley (polonyna) Hitanka in the Ivano-Frankivsk region at more than 1500 m a.s.l. (Ukraine)	Budzhak et al. 2016	2016
2058	40	mountain ranges of the Bohemian Massif along the international border (Czech Republic)	Chytry et al. 2011	1975/2011
2058	22	in some mountainous areas and basins of the Bohemian Massif (Česko)	Chytry et al. 2013	1975/2013
2058		Romania: The Eastern Carpathians (Gutâi Mountains), the Western Carpathians (Gilãu Mountains, Bihor Mountains), in the marshes of the boreal zone (the Molhasul Mare Marsh in Izbuc	Donita et al. 2005	
2058		Bohemian forest  (Upper Austria)	Dunzendorfer in Grabherr et Mucina 1993	1970
2058		Lake Hechtensee near Maria Zell (Austria)	Edlinger et Hegger in Grabherr et Mucina 1993	1984
2058		Dürnberger Moor (Styria, Austria)	Egger in Grabherr et Mucina 1993	1984
2058		Klammhöhe bei Tragöß (Austria)	Ellmauer in Grabherr et Mucina 1993	1986
2058		Gerlosplatte (Salzburg region, Austria)	Ennemoser in Grabherr et Mucina 1993	1985
2058		Hundsfeld (Obertauern, Austria)	Fuchs in Grabherr et Mucina 1993	1983
2058		Lunzer Obersee (Lower Austria)	Gams et al. in Grabherr et Mucina 1993	1927
2058		Rotmöser (Lower Austria)	Gams et al. in Grabherr et Mucina 1993	1927
2058		Zellermoos (Austria)	Haslinger in Grabherr et Mucina 1993	1975
2058		Wenger Moor (Austria)	Haslinger in Grabherr et Mucina 1993	1975
2058	8	Swiss Jura, northern marginal Alps and central Alps (Switzerland)	J.L. Richard in Ellenberg et Klötzli 1972	1966
2058		Schafberg  (Austria)	Kaiser in Grabherr et Mucina 1993	1977
2058	5	Black Forest (Germany)	Kaule	n.n.
2058		Filzmoos near Tarsdorf (Upper Austria)	Krisai in Grabherr et Mucina 1993	1961
2058		Trumer See (Salzburg, Austria)	Krisai in Grabherr et Mucina 1993	1975
2058		Lungau region (Austria)	Krisai in Grabherr et Mucina 1993	1988
2058	41	Swiss Jura, northern marginal Alps and central Alps (Switzerland)	Kuoch	1954
2058		Gerzkopf (Salzburg region, Austria)	Lainer in Grabherr et Mucina 1993	1985
2058	14	Swiss Jura, northern marginal Alps and central Alps (Switzerland)	Lüdi in Ellenberg et Klötzli 1972	1966
2058	3	Alpine foothills (Germany)	Lutz	1956
2058	1	Southwest corner of the Schluchsee (Germany)	Oberdorfer	1935
2058	1	High moor area of the Grosse Muhr (Germany)	Oberdorfer	1938
2058	4	Black Forest (Germany)	Oberdorfer	1938
2058	29	Ore Mountains (Germany)	Schmidt	n.n.
2058		Kaisergebirge (Tyrol, Austria)	Smettan in Grabherr et Mucina 1993	1981
2058		Granite and gneiss highlands in the north of Austria	Steiner in Grabherr et Mucina 1993	1992
2058	1	Nature reserve Schollacher Moos, Schollach, Neustadt district (Germany)	Th. Müller	1960
2058	3	Nature reserve Wildseemoor near Wildbad, district Calw (Germany)	Th. Müller	1960
2058	1	Schliffkopf nature reserve, district of Bühl, Offenburg, Freudenstadt (Germany)	Th. Müller	1960
2058	1	Nature reserve Fohrenmoos near Ibach, district of Säckingen (Germany)	Th. Müller	1960
2058	14	Black Forest (Germany)	Th. Müller	n.n.
2058		Rotmoos near Weichselboden (Styria, Austria)	Ullmann in Grabherr et Mucina 1993	1970
2058		Saumoos in the Lungau (Austria)	Vierhapper in Grabherr et Mucina 1993	1936
2058		Mooshamer Moor (Salzburg, Austria)	Vierhapper in Grabherr et Mucina 1993	1936
2058		Hochkönig (Austria)	Weinmeisetr in Grabherr et Mucina 1993	1983
2058		Walder Moor near Loeben (Styria, Austria)	Wolkinger in Grabherr et Mucina 1993	1964
2058		Almsee (Upper Austria)	Zimmermann  in Grabherr et Mucina 1993	1972
2059	56	mountain ranges along the state border within the Bohemian Massif (Česko)	Chytry et al. 2013	1975/2013
2059	13	Ore Mountains, Nature Protected Area  Alter Floßgraben, Nature Protected Area  Mothäuser Heide (Germany)	Schmidt	n.n.
2060	4	Mecklenburg, Brandenburg and Altmark (Germany)	Fukarek	1961
2060	20	Mecklenburg, Brandenburg and Altmark (Germany)	Kudoke	1961
2060	7	near Kartuzy (NW Poland near Gdansk)	Langguth, Kopp and  Passarge	1961
2060	8	Mecklenburg, Brandenburg and Altmark (Germany)	Passarge	1961
2060	n.n	at Oizon (Departement Cher, France) in the Pays-Fort region	Pujol et al. 2023	n.n.
2060	n.n	Streams, small rivers, seeps, pond tails and belts. At the transition to marshy alder stands. Fairly common in France and the Departments Cher, Loiret (France)    	Pujol et al. 2023	n.n.
2060	11	Border Upper Lusatian Highlands, Lower Jahna Valley, Mühlbusch Lehn, Partheniederung	Schmidt	n.n.
2061	1	Black Forest, Bavarian Forest, Allgäu, Bavarian Alps (Germany)	Baier	1974
2061	1	Midlands and Jura of Switzerland	Bardet in Ellenberg et Klötzli 1972	1966
2061	1	Midlands and Jura of Switzerland	Beger	1922
2061	13	Midlands and Jura of Switzerland	Etter	1947
2061	1	Midlands and Jura of Switzerland	Etter et Morier-Genoud	1963
2061	4	Black Forest, Bavarian Forest, Allgäu, Bavarian Alps (Germany)	Feldner	1981
2061	5	Midlands and Jura of Switzerland	Frehner	1963
2061	5	Midlands and Jura of Switzerland	Fritschi in Ellenberg et Klötzli 1972	1966
2061	1	Midlands and Jura of Switzerland	Gams	1927
2061	12	Hessian Highlands (Germany)	Hartmann	1951
2061	4	Northern Black Forest and foothills (Germany)	Hartmann	1955
2061	1	Black Forest, Bavarian Forest, Allgäu, Bavarian Alps (Germany)	Herter	1990
2061	18	Midlands and Jura of Switzerland	J.-L. Richard in Ellenberg et Klötzli 1972	1966
2061	17	Midlands and Jura of Switzerland	Klötzli in Ellenberg et Klötzli 1972	1966
2061		Rgotski Krs near Rgotina (Serbia)	Knapp 1944	1943
2061		Rgotski Krs near Rgotina (Serbia)	Knapp 1944	1943
2061	5	Midlands and Jura of Switzerland	Kuhn et Zeller in Ellenberg et Klötzli 1972	1966
2061	2	Midlands and Jura of Switzerland	Kuoch	1954
2061	3	Black Forest, Bavarian Forest, Allgäu, Bavarian Alps (Germany)	Lippert	1966
2061	2	Midlands and Jura of Switzerland	Moor	1952
2061	2	Midlands and Jura of Switzerland	Moor	1958
2061	7	Black Forest, Bavarian Forest, Allgäu, Bavarian Alps (Germany)	Müller	1969
2061	145	Growth districts: 1 Northern Hochösling, 2 Southern Hochösling, 3 Obersauer-, Wiltz-, Clierf- and Bleestal (Luxembourg)	Niemeyer et al. 2010	2010
2061	1	Black Forest, Bavarian Forest, Allgäu, Bavarian Alps (Germany)	Oberdorfer	1950
2061	6	Leinebergwald (Germany)	Rühl	1954
2061	12	Leinebergwald (Germany)	Rühl	1960
2061	2	Black Forest, Bavarian Forest, Allgäu, Bavarian Alps (Germany)	S. Görs	n.n.
2061	18	Small areas on the Rhine valley slope and on Eschner Berg (Liechtenstein) 	Schmider et Burnand 1988	1988
2061	21	Black Forest, Bavarian Forest, Allgäu, Bavarian Alps (Germany)	Storch	1983
2061	12	Low mountain ranges south of Hannover, Harz, (steep shady cool rocky outcrops on silicate and limestone) (Germany)	Tüxen	1937
2061	1	Midlands and Jura of Switzerland	Winteler	1927
2061	3	Midlands and Jura of Switzerland	Wirz	1958
2062	1	Trebel, Trebel canal (Germany)	Bolbrinker	1992
2062	20	Riparian vegetation in the Warnow catchment area (Germany)	Clausnitzer	1993
2062	9	Ralower wood (Germany)	Griesel et al.	1993
2062		Stolzenhagen near Oder (Germany)	Hofmann et Pommer 2013 	2013
2062	n.n.	Medio-European France	Julve 	2024
2062	1	Wilsickower Os (Germany)	Kaussmann et al.	1982
2062	10	South-East Rügen Biosphere Reserve (Germany)	Kurschat	1993
2062	18	Wutach area, Lake Constance area, Neckar area, Swabian Alb, Swabian-Franconian Forest, eastern Alpine foothills (Germany)	Michiels	1986
2062	1	Nature Protected Area  Hellberge (Germany)	Mohr	1994
2062	3	Nature Protected Area  Kucks- and Lapitzer Lake (Germany)	Mohr and  Hofmann	1992
2062	1	Schaalsee Landscape Nature Park (Germany)	Mordhorst	1997
2062	131	Growth districts: 3 Obersauer-, Wiltz-, Clierf- and Bleestal, 10 Eisch-Mamer-Gutland, 11 Schooffielser and Müllerthaler Gutland, 14 Pafebierger and Oetringer Gutland (Luxembourg)	Niemeyer et al. 2010	2010
2062	1	Wutach area, Lake Constance area, Neckar area, Swabian Alb, Swabian-Franconian Forest, eastern Alpine foothills (Germany)	Oberdorfer	1971
2062	6	Forests of the young moraine landscape around Dargun (Germany)	Passarge	1959
2062	6	North--West Mecklenburg (Germany)	Passarge	1960
2062	12	South-East Rügen (Germany)	Paulson and  Raskin	1998
2062	141	Wutach area, Lake Constance area, Neckar area, Swabian Alb, Swabian-Franconian Forest, eastern Alpine foothills (Germany)	Pfadenhauer	1969
2062	10	Inland coast Mönchsgut Rügen (Germany)	Polte	1996
2062	1	Wutach area, Lake Constance area, Neckar area, Swabian Alb, Swabian-Franconian Forest, eastern Alpine foothills (Germany)	S. Görs	n.n.
2062	13	Nature reserve Weißeritztalhänge, Müglitztal south of railroad station Burkhardswalde-Maxen, Nature reserve Wesenitztalhang near Zatschke (Germany)	Schmidt	n.n.
2062	1	Island of Vilm (Germany)	Schötteldreier	1995
2062	21	Wutach area, Lake Constance area, Neckar area, Swabian Alb, Swabian-Franconian Forest, eastern Alpine foothills (Germany)	Schrag	1985
2062	1	Wutach area, Lake Constance area, Neckar area, Swabian Alb, Swabian-Franconian Forest, eastern Alpine foothills (Germany)	Sebald	1983
2062	2	Wutach area, Lake Constance area, Neckar area, Swabian Alb, Swabian-Franconian Forest, eastern Alpine foothills (Germany)	Seibert	1958
2062	9	Wutach area, Lake Constance area, Neckar area, Swabian Alb, Swabian-Franconian Forest, eastern Alpine foothills (Germany)	Seibert	1962
2062	4	Wutach area, Lake Constance area, Neckar area, Swabian Alb, Swabian-Franconian Forest, eastern Alpine foothills (Germany)	Seibert	1969
2062	8	Wutach area, Lake Constance area, Neckar area, Swabian Alb, Swabian-Franconian Forest, eastern Alpine foothills (Germany)	Seiffer	1984
2062	3	Eldena nature reserve (Germany)	Spangenberg	1999
2062	6	Wutach area, Lake Constance area, Neckar area, Swabian Alb, Swabian-Franconian Forest, eastern Alpine foothills (Germany)	Stangl	1985
2062	97	Wutach area, Lake Constance area, Neckar area, Swabian Alb, Swabian-Franconian Forest, eastern Alpine foothills (Germany)	Th. Müller	n.n.
2062	1	Brühler Bach in the Weitendorf area (Germany)	Voigtländer	1993
2062	5	Nature Protected Area  push end moraine north of Remplin (Germany)	Voigtländer	1996
2062	35	Erosion channels to the Malchin and Teterow basins (Germany)	Wollert	1973
2062	11	at the edge of the Malchin Basin (Germany)	Wollert	1984
2062	1	Kummerow Basin and Peene Valley between Saalem and Upost (Germany)	Wollert	1993
2062	10	Stream sections in the district of Güstrow (Germany)	Wollert and  Bolbrinker	1994
2063	3	Lower Vogtland and Saale area (Germany)	F. K. Hartmann	1956
2063	22	Lower Vogtland (valley of the White Elster) (Germany)	Niemann	1956
2064	20	Harz (Germany)	Stöcker	1962
2065		on avalanche paths in southern Vorarlberg (Austria)	Grabherr et Polatschek in Mucina, Grabherr et Ellmauer 1993 	1986
2065	12	Röhn (Germany)	Lohmeyer, Bohn	1972
2065	n.n.	Ore Mountains, Zittau Mountains (e.g. Bärenstein, Pöhlberg, Geising, Lausche) (Germany)	Schmidt	n.n.
2065		Salzburg (Austria)	Wittmann et Strobl in Mucina, Grabherr et Ellmauer 1993 	1990
2066	4	montane and submontane rivers, especially in the Šumava and Moravskoslezské Beskydy Mountains (Česko)	Chytry et al. 2013	1975/2013
2066		Romania: intrazonal, along watercourses, in the Eastern Carpathians and Subcarpathians of Moldova, Southern Carpathians, Lunca Oltului, Valea Sadului, Valea Dunãrii at Orsova, Eselnita, Western Carpathians	Donita et al. 2005	1968-1990
2066	4	Drava between Mauthbrücken and Sachsenburg (Carinthia, Austria)	Egger	1992
2066	1	Salzach floodplains in Flachgau and Tennengau (Salzburg)	Jelem	1965
2066	9	Tullnerfeld and Wachau, Marchfeld and Korneuburger Berge (Austria)	Jelem	1974
2066	n.n.	Département Ardennes  (France)	Julve 	2024
2066	6	Eastern edge of the Alps (Austria)	Knapp	1944
2066	17	Inn floodplains near Braunau (Austria)	Krammer	1953
2066	2	Inn valley between Telfs and Wörgl (Austria)	Krewedl	1992
2066	8	Isar estuary (Germany)	Linhard	1964
2066	n.n	On coarse subtrates subject to river dynamics in Departments Cher, Loiret (France)    	Pujol et al. 2023	n.n.
2066	4	Riverine forests of the alpine foothills of Lower Austria	Rauscher	1990
2066	2	Chiemsee (Germany)	Schauer, Duensing	n.n.
2066	3	Isar floodplain north of Munich (Germany)	Seibert	1962
2066	1	Danube floodplain near Neuburg (Germany)	Seibert	n.n.
2066	3	Lech estuary (Germany)	Seibert	n.n.
2066	5	Along the Danube, Szigetköz, Csepel-sziget, Baja vidéke, Tisza (Hungary)	Soó 1964	1964
2066	3	Linz/Danube (Austria)	Stockhammer	1964
2066	7	Danube floodplains near Wallsee (Austria)	Wendelberger-Zelinka	1952
2067	7	Mecklenburg-Western Pomerania (Germany)	Blümel and  Tepke	2000
2067		Romania: intrazonal, along the Danube to the Delta and, in invasive expansion,  along the rivers and streams of the Romanian Plain, Oltenia, Transylvania,	Donita et al. 2005	1968-1974
2067	1	Drau between Mauthbrücken and Sachsenburg (Carinthia, Austria)	Egger	1992
2067	7	near Belgrade (Serbia)	Gajic	1954
2067	n.n.	Vorarlberg and Salzburg (Austria)	Grabherr, Polatschek	1986
2067	1	Salzach floodplains in Flachgau and Tennengau (Salzburg)	Jelem	1965
2067	21	Tullnerfeld and Wachau, Marchfeld and Korneuburger Berge (Austria)	Jelem	1974
2067	1	Upper Lech Valley (Germany)	Karl	1954
2067	4	Inn floodplains near Braunau (Germany)	Kramer	1953
2067	13	Inn floodplains near Braunau (Austria)	Krammer	1953
2067	5	Elbe valley near Boitzenburg, Dömitz and Rüterberg (Germany)	LAG Vegetationskunde MV	2000
2067	2	Riverine forests along the Leitha (Austria)	Lazowski	1989
2067	4	Isar estuary (Germany)	Limhard	1963
2067	4	Taubergießen (Upper Rhine)	Müller	1974
2067	20	lower Murrtal (Germany)	Müller	1985
2067	44	upper Danube, Lauter, Kocher and Neckar valleys (Germany)	Müller	n.n.
2067	5	Illertal valley (Germany)	Müller and  Görs	1958
2067	5	Aitrach, Iller and Argental valleys (Germany)	Müller, Görs	1958
2067	10	at Our, Moselle, Wark, Attert and Kailsbaach (Luxembourg)	Niemeyer et al. 2010	2010
2067	2	Upper Rhine and Günztal (Germany)	Oberdorfer	1957
2067		Tagliamento river - between Mussons and Canussio; Tagliamento river - Candussio, Ragogna; Taro river - Noceto, quarry lakes area; Tagliamento river -Gorgo, embankment (Italy)	Poldini et al. 2020	2020
2067		Taro river - Medesano; Serchio river, middle course; Fino river, Appignani; Tavo river, Congiunti; Pescara river - contrada Villa Reja; Brenta river - above Fontaniva;  (Italy)	Poldini et al. 2020	2020
2067		Saline river (Abruzzo); Tagliamento river - between Casarsa and Bolzano, Tagliamento river - Candussio, Ragogna (Friuli Venezia Giulia); Aventino river (Italy)	Poldini et al. 2020	2020
2067		Stirone river - S. Nicomede; Tagliamento river - between Casarsa and Bolzano; Taro river - Medesano; Sangro river - Taverna Nova; Stirone river - S. Nicomede, Fidenza (Italy)	Poldini et al. 2020	2020
2067	n.n	Banks of watercourses, rarely of water bodies, subject to heavy flooding and high tides  in Departments Cher, Indre-et-Loire, Loiret (France)    	Pujol et al. 2023	n.n.
2067	n.n	at Herry (Departement Cher, France) on the banks of the Loire	Pujol et al. 2023	n.n.
2067	2	Riverine forests of the Lower Austrian Alpine foothills	Rauscher	1990
2067	5	northwestern tertiary hill country (Lower Bavaria) (Germany)	Rodi	1975
2067	4	Isar floodplains north of Munich (Germany)	Seibert	1962
2067	3	Lech estuary (Germany)	Seibert	n.n.
2067	3	Rott valley near Ruhstorf (Germany)	Seibert	n.n.
2067	1	Isar floodplain near Wolfratshausen (Germany)	Seibert and  Conrad	n.n.
2067	8	Isar floodplain near Wolfratshausen (Germany)	Seibert and  Zielonkowski	1972
2067	9	Vojvodina	Slavnic	1952
2067	4	at the Giessgang in the Danube floodplains between Altenwörth and Korneuburg (Austria)	Straka	1992
2067	7	Upper Swabia (Germany)	Th. Müller	n.n.
2067	n.n.	Vorarlberg and Salzburg (Austria)	Wittmann, Strobl	1990
2067	10	Danube floodplain between Regensburg and Straubing (Germany)	Zahlheimer	1979
2068		Kiens (Province South Tyrol, Italy)	AfF Südtirol	2010
2068	n.n.	Gaisberg (Salzburg/Austria)	Amberger	1991
2068	n.n.	eastern Graubünden, Münstertal, Oberinntal (Germany)	Braun-Blanquet et al.	1954
2068	n.n.	Ammergau Mountains/Bavaria (Germany)	Feldner	1978
2068	n.n.	Lorüns (Vorarlberg/Austria)	Grabherr	n.n.
2068	32	middle Northern Limestone Alps (Germany)	Hölzel	1996
2068	4	Protective forests of the Tyrolean peripheral and intermediate Alps	Hotter	1996
2068	n.n.	Northern Limestone Alps (Germany)	Mayer, Zimmermann	1974
2068	n.n.	Eastern Karawanken (Carinthia/Austria)	Ranner	1988
2068	n.n.	Salzburg Limestone Alps (Austria)	Schlager	1983
2068	n.n.	Mieminger Mountains/Tyrol	Starlinger	1988
2068	n.n.	Mieminger Mountains/Tyrol	Weber	1981
2069	75	scattered in mountainous areas, but also found in the high hills and foothills (Česko)	Chytry et al. 2013	1975/2013
2069	21	Bavarian Forest (Germany)	Trautmann in Matuszkiewicz	1952
2069	7	Bavarian Forest (Germany)	Volk	1939
2070	39	in the Drebin, the Czech Karst, and the Posumavské hills; Bohemian mid-hills, Liběchovsku region,  Ještědském ridge, Kokořínska region, Turnov region , Podkrkonoší near Vrchlabí, the middle Posázaví near Sázavy, the Moravian Karst, near and Štramberk, Šia	Chytry et al. 2013	1975/2013
2070	8	Meiningen shell limestone area (Germany)	Hofmann	1956
2070		Parlow in the Uckermark (Germany)	Hofmann et Pommer 2013 	2013
2071	5	Eastern and middle Sudeten	F. K. Hartmann	1942
2071	12	Sudetenland in southwest Poland	Matuszkiewicz J.M. (1993)	1973
2072		Deutschnofen (Province South Tyrol, Italy)	AfF Südtirol	2010
2072	n.n.	Warmbad-Villach (Carinthia/Austria)	Aichinger	1957
2072		Regioni avanapica e esalpica della Lombardia (Italy)	Andreis 2008	2008
2072		mid-alpine and exalpine sectors of the Alps, from the lower Susa Valley to the Tanaro Valley. In the Vigezzo Valley, Divedro Valley and upper Cannobina Valley (Italy)	Camerano et al. 2008	2008
2072	n.n.	serpentine area near Kirchdorf/Styria (Austria)	Eggler	1954
2072	n.n.	Ötztal (Central Alps, Tyrol/Austria)	Ellmauer	n.n.
2072	n.n.	Switzerland	Glavac	1972
2072	n.n.	Brandnertal (Austria)	Grabherr	1988
2072	n.n.	Murau Nockberge (Austria)	Jelem, Kilian	1966
