Comm_ID	Account of relevés	Locations of relevés	Authors	Year of occurances
4935	41	Alsace (France), Palatinate, Upper Rhine area, Neckar area, Main-Tauber area, central and eastern Swabian Alb, Ries, Danube area, Hegau (Germany)	Th. Müller	1972
4935	6	Alsace (France), Palatinate, Upper Rhine area, Neckar area, Main-Tauber area, central and eastern Swabian Alb, Ries, Danube area, Hegau (Germany)	Th. Müller	n.n.
4935	4	Alsace (France), Palatinate, Upper Rhine area, Neckar area, Main-Tauber area, central and eastern Swabian Alb, Ries, Danube area, Hegau (Germany)	Ullmann	1977
4936	8	in lowland and colline areas of the Czech Republic	Chytry et al. 2009	1975/2009
4936	47	central and western Europe. In the Netherlands restricted to the river area, the dunes south of Bergen (Renodunal district) and cities in the west of the country	Schaminée et al. 2010	2010
4937		Vienna basin  (Austria)	Brandes in Mucina, Grabherr et Ellmauer 1993 	1982
4937		Weinviertel region (Austria)	Brandes in Mucina, Grabherr et Ellmauer 1993 	1982
4937		Wachau region (Austria)	Brandes in Mucina, Grabherr et Ellmauer 1993 	1989
4937	100	initial stages of secondary succession in and around human settlements in the Czech Republic	Chytry et al. 2009	1975/2009
4937		eastern   Austria	Forstner in Mucina, Grabherr et Ellmauer 1993 	1984
4937		Leoben (Austria)	Holzner in Mucina, Grabherr et Ellmauer 1993 	1973
4937		Knittelfeld (Austria)	Holzner in Mucina, Grabherr et Ellmauer 1993 	1973
4937	4	Magdeburg and Berlin (Germany)	Passarge	1964
4937	12	South-East-Altmark and Berlin (Germany)	Passarge	1964
4938	35	common in warm lowland and colline areas in the Czech Republic	Chytry et al. 2009	1975/2009
4938	2	North- and Middle-Mecklenburg (Germany)	Fröde	1958
4938	n.n.	all French Regions except coast of Provence-Alpes (France)	Julve 	2024
4938	8	North- and Middle-Mecklenburg (Germany)	Passarge	1959
4938	10	Brandenburg (Germany)	Passarge	1959
4938	16	East-Mecklenburg and Brandenburg (Germany)	Passarge	1964
4938	n.n.	Cities, villages and disturbed sites in an anthropogenic context in Departments Cher,  l'Eure-et-Loir, Indre, Indre-et-Loire, Loir-et-Cher, Loiret (France)    	Pujol et al. 2023	n.n.
4938		Allende, Cantabria (Spain)	Rivas-Martinez et al. 1984	1984
4938	15	commonly spread throughout the whole Hungary	Soó 1964	1964
4939	135	common from lowland to submontane areas of the Czech Republic	Chytry et al. 2009	1975/2009
4939		Romania: Along the roads and railways throughout the country, but especially in the south and east (Banat, Oltenia, Muntenia, Dobrogea, Moldova)	Donita et al. 2005	1998-2001
4939	32	Mecklenburg, Altmark and West- and North-Brandenburg (Germany)	Passarge	1959
4939	n.n.	in semi-ruderal, pioneer scrubland in Departement Cher (France)	Pujol et al. 2023	n.n.
4939	20	commonly spread throughout the whole Hungary	Soó 1964	1964
4939		Vranje, Šabac, Pančevo, Beograd, Smederevo, Kragujevac, Kikinda (Serbia)	Tabasevic et al. 2023	2015-2020
4939		Vranje, Šabac, Pančevo, Beograd, Smederevo, Kragujevac, Kikinda (Serbia)	Tabasevic et al. 2023	2015-2020
4940		Finkenstein, Karawanken (Austria)	Aichinger in Mucina, Grabherr et Ellmauer 1993 	1933
4940		Mistelhofen, Karawanken (Austria)	Aichinger in Mucina, Grabherr et Ellmauer 1993 	1933
4940		Heilige Geist, Karawanken (Austria)	Aichinger in Mucina, Grabherr et Ellmauer 1993 	1933
4940		Rosenbach, Karawanken (Austria)	Aichinger in Mucina, Grabherr et Ellmauer 1993 	1933
4940		Gurk lowland (Carinthia, Austria)	Aichinger in Mucina, Grabherr et Ellmauer 1993 	1963
4940		Matrei (eastern Tyrol, Austria)	Brandes in Mucina, Grabherr et Ellmauer 1993 	1987
4940		Strandwall near Rossbeigh, Co. Kerry (Ireland)	Braun-Blanquet et Tüxen	1951
4940		at pub near Lough Cluain, C. Kerry (Ireland)	Braun-Blanquet et Tüxen	1951
4940		Pathway in Wexford (Ireland)	Braun-Blanquet et Tüxen	1951
4940		Pathway at Loch Gill near Sligo (Ireland)	Braun-Blanquet et Tüxen	1951
4940		Pathway at Carrowkeel, C. Sligo (Ireland)	Braun-Blanquet et Tüxen	1951
4940		Farm near Furnace, Co. Mayo (Ireland)	Braun-Blanquet et Tüxen	1951
4940		Pathway in Ballymakeery, C. Cork (Ireland)	Braun-Blanquet et Tüxen	1951
4940		quite scattered in Sicily, Italy	Cambria 2019	1983
4940	162	 throughout the Czech Republic from lowlands up to the montane belt (Česko)	Chytry et al. 2007	1975/2007
4940		Romania: Waste land, roadsides,  paths, courtyards, throughout the country	Donita et al. 2005	1967-2001
4940	1	Mecklenburg (Germany)	Fröde	1950
4940		Eichgraben near Vienna (Austria)	Gilli in Mucina, Grabherr et Ellmauer 1993 	1935
4940	n.n.	Medio-European France	Julve 	2024
4940	48	Mecklenburg, Brandenburg and Magdeburg district (Germany)	Passarge	1957
4940	4	East-Brandenburg and middle Elbe valley (Germany)	Passarge	1957
4940	n.n.	at Dhuizon in Sologne.	Pujol et al. 2023	n.n.
4940	n.n.	Meadow entrances, paths and, more generally, places where livestock congregate in Departments Cher,  l'Eure-et-Loir, Indre, Indre-et-Loire, Loir-et-Cher, Loiret (France)    	Pujol et al. 2023	n.n.
4940		Vada, Liebana, Cantabria (Spain)	Rivas-Martinez et al. 1984	1984
4940	55	widespread in large parts of the northern hemisphere, with a clear optimum in the lowlands. In the Netherlands, the association is very common in all districts.	Schaminée et al. 2010	2010
4940	15	commonly spread throughout the whole Hungary	Soó 1964	1964
4940		Vranje, Smederevo, Kragujevac, Kladovo, Subotica, Novi Sad, Banatski Karlovci, Sremski Karlovci, Užice, Beograd, and Pančevo, Vladičin Han, Šabac, Sremska Mitrovica, Loznica, and Valjevo	Tabasevic et al. 2023	2015-2020
4940		Vranje, Smederevo, Kragujevac, Kladovo, Subotica, Novi Sad, Banatski Karlovci, Sremski Karlovci, Užice, Beograd, and Pančevo, Vladičin Han, Šabac, Sremska Mitrovica, Loznica, and Valjevo	Tabasevic et al. 2023	2015-2020
4940		path near Navia (Spain)	Tüxen et Oberdorfer 1958	1953
4940		Parador de Arguis (S-Pyreneen, Spain)	Tüxen et Oberdorfer 1958	1953
4940		path south of Covadonga (Spain)	Tüxen et Oberdorfer 1958	1953
4940		Gijón (Spain)	Tüxen et Oberdorfer 1958	1953
4940		railway track near Cervera de Pisuerga (Spain)	Tüxen et Oberdorfer 1958	1953
4940		Teichalm-Hochtal (Styria, Austria)	Zimmermann et Mauerer in Mucina, Grabherr et Ellmauer 1993 	1989
4941		Piesting valley (Austria)	Balatova-Tulackova et Hübl in Mucina, Grabherr et Ellmauer 1993 	1974
4941		Ennis, Co. Clare (Ireland)	Braun-Blanquet et Tüxen	1951
4941		River Lee near Gearagh south of Macroom, C. Cork (Ireland)	Braun-Blanquet et Tüxen	1951
4941		Roundstone, Co. Galway (Ireland)	Braun-Blanquet et Tüxen	1951
4941		Dornbirn (Vorarlberg, Austria)	Grabherr in Mucina, Grabherr et Ellmauer 1993 	1987
4941	n.n.	Départements Aube, Marne, Ardennes, Nord, Pas-de-Calais, Somme (France)	Julve 	2024
4941	251	subatlantic range in Europe. In the Netherlands Its greatest distribution here is in the river area, the Pleistocene districts and the low moorland areas	Schaminée et al. 2010	2010
4941		Feistritz  valley (Austria)	Steinbuch in Mucina, Grabherr et Ellmauer 1993 	1980
4941	50	southern Upper Rhine area, Swabian Alb, further Neckar area, Tauber valley (Main area) and Hegau region (Germany)	Th. Müller	1974
4942	10	along the Labe river in central and eastern Bohemia and the Dyje river in southern Moravia (Česko)	Chytry et al. 2007	1975/2007
4942	3	lower Elbe valley (Stude lowlands) (Germany)	Passarge	1964
4943	17	across the whole Czech Republic except in high mountain areas; most frequent in lowlands and warm colline areas in the Czech Republic	Chytry et al. 2011	1975/2011
4943		Widespread on nitrate- and salt-rich ruderal sites in the lowlands and hills of Austria	Mucina in Mucina, Grabherr et Ellmauer 1993 	1993
4943	30	middle Elbe floodplain and Oder valley (Germany)	Passarge	1964
4943	11	Plain, especially the Tisza, is certainly more widespread (Hungary)	Soó 1964	1964
4944		Eferdinger basin (Austria)	Hofbauer in Mucina, Grabherr et Ellmauer 1993 	1985
4944	n.n.	Départements Haut-Rhin, Bas-Rhin, Haute-Marne, Aube, Marne, Saone-et-Loire, Cote d'Or, Yonne, Haute-Saone (France)	Julve 	2024
4944	21	Upper Rhine Plain (Germany)	Korneck	1963
4944	2	Upper Rhine plain (Germany)	Lüpnitz	1967
4944		Dunawiesen meadows near Drösing at March  (Austria)	Plenk in Mucina, Grabherr et Ellmauer 1993 	1991
4945	149	most common vegetation types of trampled habitats occurring from the lowlands to sub-montane areas throughout the Czech Republic	Chytry et al. 2009	1975/2009
4945		Widespread in flower beds, parks and others from the lowlands to the montane zone of Austria.	Mucina in Mucina, Grabherr et Ellmauer 1993 	1993
4945	5	Altmark, Brandenburg (Germany)	Passarge	1964
4945		Llanaves de la Reina, Leon (Spain)	Rivas-Martinez et al. 1984	1984
4945	15	commonly spread throughout the whole Hungary	Soó 1964	1964
4945		Vranje, Smederevo, Kragujevac, Kladovo, Subotica, Novi Sad, Banatski Karlovci, Kikinda, Sremski Karlovci, Užice, Čačak, Beograd, and Pančevo, Vladičin Han, Niš, Šabac, Sremska Mitrovica, Loznica, and Valjevo	Tabasevic et al. 2023	2015-2020
4945		Vranje, Smederevo, Kragujevac, Kladovo, Subotica, Novi Sad, Banatski Karlovci, Kikinda, Sremski Karlovci, Užice, Čačak, Beograd, and Pančevo, Vladičin Han, Niš, Šabac, Sremska Mitrovica, Loznica, and Valjevo	Tabasevic et al. 2023	2015-2020
4946	76	Upper Rhine area (Germany)	Korneck	1962
4946	21	Schweinfurt dry area (Germany)	Korneck	1962
4946	1	Upper Rhine area (Germany)	Oberdorfer	n.n.
4946	84	Upper Rhine area (Germany)	Philippi	1960
4947	49	in lowland areas of the Czech Republic	Chytry et al. 2009	1975/2009
4947	3	widespread at farm houses in the Pannonian region of Austria.	Mucina in Mucina, Grabherr et Ellmauer 1993 	1993
4947	85	East-Mecklenburg and Brandenburg (Germany)	Passarge	1957
4947	20	Middle- and East-Mecklenburg (Germany)	Passarge	1959
4947	25	West- and Middle-Mecklenburg (Germany)	Passarge	1959
4947	n.n.	Abandoned towns, villages and industrial sites in Departments Cher,  l'Eure-et-Loir, Indre, Indre-et-Loire, Loir-et-Cher, Loiret (France)    	Pujol et al. 2023	n.n.
4947	15	commonly spread throughout the whole Hungary	Soó 1964	1964
4948		eastern Tyrol (Austria)	Brandes in Mucina, Grabherr et Ellmauer 1993 	1979
4948		Pustertal (South Tyrol, Italy)	Brandes in Mucina, Grabherr et Ellmauer 1993 	1979
4948	110	from the lowlands to submontane areas in the Czech Republic	Chytry et al. 2009	1975/2009
4948		Burgenland (Austria)	Forstner in Mucina, Grabherr et Ellmauer 1993 	1993
4948	2	West- and North-Mecklenburg (Germany)	Fröbe	1958
4948		Vorarlberg (Austria)	Grabherr et Polatschek in Mucina, Grabherr et Ellmauer 1993 	1986
4948		Lower Austria	Hübl et Holzner in Mucina, Grabherr et Ellmauer 1993 	1977
4948		Vienna (Austria)	Hübl et Holzner in Mucina, Grabherr et Ellmauer 1993 	1977
4948	n.n.	Regions Normandie, Hauts-de-France, Bourgogne-Franche-Comté  (France)	Julve 	2024
4948	5	West- and North-Mecklenburg (Germany)	Passarge	1964
4948	25	East-Mecklenburg and Brandenburg (Germany)	Passarge	1964
4948	n.n.	Roadsides, quarries, gravel pits, ballast, building sites in Departments Cher,  l'Eure-et-Loir, Indre, Indre-et-Loire, Loir-et-Cher, Loiret (France)    	Pujol et al. 2023	n.n.
4948		Salzburg (Austria)	Reisinger in Mucina, Grabherr et Ellmauer 1993 	1993
4948		northern Tyrol (Austria)	Smettan in Mucina, Grabherr et Ellmauer 1993 	1981
4948	15	spreading everywhere, especially on backfills (Hungary)	Soó 1964	1964
4949		Tullamore, C. Offaly (Ireland)	Braun-Blanquet et Tüxen	1951
4949	2	Wexford (Ireland)	Braun-Blanquet et Tüxen	1951
4949		Farm near Ballyvaughan, C. Clare (Ireland)	Braun-Blanquet et Tüxen	1951
4949		Habour of Sligo (Ireland)	Braun-Blanquet et Tüxen	1951
4949	183	common throughout the Czech Republic from lowland to submontane areas	Chytry et al. 2009	1975/2009
4949	n.n.	Regions Normandie, Hauts-de-France, Bourgogne-Franche-Comté  (France)	Julve 	2024
4949	4	Widespread at ruderal sites anlong roads and in settlements of warm eastern Austria	Mucina in Mucina, Grabherr et Ellmauer 1993 	1993
4949	51	Mecklenburg, Altmark and Brandenburg (Germany)	Passarge	1959
4949	n.n.	Streamsides, paths and roadsides in Departments Cher,  l'Eure-et-Loir, Indre, Indre-et-Loire, Loir-et-Cher, Loiret (France)    	Pujol et al. 2023	n.n.
4949	55	Western and central Europe. In the Netherlands common throughout the country, except the peat and sea clay areas; rare in northern clay district	Schaminée et al. 2010	2010
4949	15	commonly spread throughout the whole Hungary	Soó 1964	1964
4949		Loznica, Užice, Vranje, Vladičin Han (Serbia)	Tabasevic et al. 2023	2015-2020
4949		Loznica, Užice, Vranje, Vladičin Han (Serbia)	Tabasevic et al. 2023	2015-2020
4950		Palten valley near Rottenmann (Austria)	Balatova-Tulackova et Hübl in Mucina, Grabherr et Ellmauer 1993 	1974
4950	132	widespread across the Czech Republic, with the exception of dry lowlands and the highest mountain areas (Česko)	Chytry et al. 2007	1975/2007
4950		Romania: Transylvania, Muntenia, and Moldova	Donita et al. 2005	1995-1997
4950	1	Donauried (Germany)	Eskuche	1955
4950		Egelseen near Schleedorf (Austria)	Forsthuber in Mucina, Grabherr et Ellmauer 1993 	1978
4950	2	Lake Constance area (Germany)	G. Lang	1973
4950		Schwarzenach in the Bregenz district (Austria)	Grabherr in Mucina, Grabherr et Ellmauer 1993 	1986
4950	n.n.	Départements Haut-Rhin, Bas-Rhin, Vosges, Moselle (France)	Julve 	2024
4950	6	Hessian Highlands (Germany)	Knapp, Stoffers	1962
4950	4	Upper Rhine Plain (Germany)	Korneck	1963
4950		Zirl in the Inn valley (Tyrol, Austria)	Krewedl in Mucina, Grabherr et Ellmauer 1993 	1992
4950		Rinn in the Inn valley (Tyrol, Austria)	Krewedl in Mucina, Grabherr et Ellmauer 1993 	1992
4950	1	Upper Palatinate Jura (Germany)	Merkel	1979
4950	1	Lake Constance area (Germany)	Oberdorfer	n.n.
4950	6	Tauber area (Main area) (Germany)	Philippi	n.n.
4950	3	Upper Palatinate Jura (Germany)	Rosskopf	1971
4950	14	Upper Swabia (Germany)	S. Görs	n.n.
4950	14	Sátor-hegység, Bükk,  Matra, Green hills of Gödöllő, Börzsöny, Vertes, Bakonyalja, Cserhát, Vas, Zala, Tapolca basin, Duna-Tisza region, Vend-videk, Nyírség (Hungary)	Soó 1964	1964
4950	50	Swabian Alb area (Germany)	Th. Müller	n.n.
4950	12	North-West-Germany (Germany)	Tüxen	1937
4950		flood plains of small and large rivers, such as the Prut and Dniester valleys (Republic Moldova)	Ungureanu et al.	2017
4950	1	Kaiserstuhl (Germany)	von Rochow	1951
4950	2	Swiss midland (Germany)	W. Koch	1926
4951	3	North-West-Mecklenburg (Germany)	Passarge	1964
4951	7	at the Föhrden of Schleswig-Holstein, in North-West-Germany, at the Weser u. Elbe, in Central Germany at the Weser (Allendorf-Sooden), at Saale and Unstrut (Germany)	Tüxen	1937
4952	174	common in submontane and montane areas of the Czech Republic	Chytry et al. 2009	1975/2009
4952	2	Main-Tauber area, Hohenlohe, Neckar area, Upper Rhine area, Alb foreland, Danube and Isar, Swabian-Franconian Forest, Odenwald, Black Forest, Swabian Alb, Baar plateau, Allgäu, Swiss Alpine foreland (Germany)	Eskuche	1955
4952		Roadside banks in Burgenland (Austria)	Forstner in Mucina, Grabherr et Ellmauer 1993 	1983
4952		Roadside banks at Hinterer Gosausee (Dachstein, Austria)	Göd in Mucina, Grabherr et Ellmauer 1993 	1983
4952	5	Main-Tauber area, Hohenlohe, Neckar area, Upper Rhine area, Alb foreland, Danube and Isar, Swabian-Franconian Forest, Odenwald, Black Forest, Swabian Alb, Baar plateau, Allgäu, Swiss Alpine foreland (Germany)	Görs	1958
4952	20	Main-Tauber area, Hohenlohe, Neckar area, Upper Rhine area, Alb foreland, Danube and Isar, Swabian-Franconian Forest, Odenwald, Black Forest, Swabian Alb, Baar plateau, Allgäu, Swiss Alpine foreland (Germany)	Görs	1969
4952		Roadside banks in Lower Austria	Holzner in Mucina, Grabherr et Ellmauer 1993 	1978
4952	n.n.	Départements Vosges, Doubs, Jura, Isére, Savoie, Haute-Savoie, Hautes-Alpes, Moselle, Ardennes (France)	Julve 	2024
4952	1	Main-Tauber area, Hohenlohe, Neckar area, Upper Rhine area, Alb foreland, Danube and Isar, Swabian-Franconian Forest, Odenwald, Black Forest, Swabian Alb, Baar plateau, Allgäu, Swiss Alpine foreland (Germany)	Kuhn	1937
4952	2	Main-Tauber area, Hohenlohe, Neckar area, Upper Rhine area, Alb foreland, Danube and Isar, Swabian-Franconian Forest, Odenwald, Black Forest, Swabian Alb, Baar plateau, Allgäu, Swiss Alpine foreland (Germany)	Lang	1969
4952	2	Main-Tauber area, Hohenlohe, Neckar area, Upper Rhine area, Alb foreland, Danube and Isar, Swabian-Franconian Forest, Odenwald, Black Forest, Swabian Alb, Baar plateau, Allgäu, Swiss Alpine foreland (Germany)	Lang	1971
4952	2	Main-Tauber area, Hohenlohe, Neckar area, Upper Rhine area, Alb foreland, Danube and Isar, Swabian-Franconian Forest, Odenwald, Black Forest, Swabian Alb, Baar plateau, Allgäu, Swiss Alpine foreland (Germany)	Libbert	1939
4952	1	Main-Tauber area, Hohenlohe, Neckar area, Upper Rhine area, Alb foreland, Danube and Isar, Swabian-Franconian Forest, Odenwald, Black Forest, Swabian Alb, Baar plateau, Allgäu, Swiss Alpine foreland (Germany)	Lohmeyer	1957
4952	18	Main-Tauber area, Hohenlohe, Neckar area, Upper Rhine area, Alb foreland, Danube and Isar, Swabian-Franconian Forest, Odenwald, Black Forest, Swabian Alb, Baar plateau, Allgäu, Swiss Alpine foreland (Germany)	Moor	1958
4952		Roadside banks in northern Styria (Austria)	Mucina in Mucina, Grabherr et Ellmauer 1993 	1993
4952	3	Main-Tauber area, Hohenlohe, Neckar area, Upper Rhine area, Alb foreland, Danube and Isar, Swabian-Franconian Forest, Odenwald, Black Forest, Swabian Alb, Baar plateau, Allgäu, Swiss Alpine foreland (Germany)	Müller, Görs	1958
4952	9	Main-Tauber area, Hohenlohe, Neckar area, Upper Rhine area, Alb foreland, Danube and Isar, Swabian-Franconian Forest, Odenwald, Black Forest, Swabian Alb, Baar plateau, Allgäu, Swiss Alpine foreland (Germany)	Oberdorfer	1949
4952	3	Main-Tauber area, Hohenlohe, Neckar area, Upper Rhine area, Alb foreland, Danube and Isar, Swabian-Franconian Forest, Odenwald, Black Forest, Swabian Alb, Baar plateau, Allgäu, Swiss Alpine foreland (Germany)	Oberdorfer	1957
4952	8	Main-Tauber area, Hohenlohe, Neckar area, Upper Rhine area, Alb foreland, Danube and Isar, Swabian-Franconian Forest, Odenwald, Black Forest, Swabian Alb, Baar plateau, Allgäu, Swiss Alpine foreland (Germany)	Oberdorfer	1969
4952	8	Main-Tauber area, Hohenlohe, Neckar area, Upper Rhine area, Alb foreland, Danube and Isar, Swabian-Franconian Forest, Odenwald, Black Forest, Swabian Alb, Baar plateau, Allgäu, Swiss Alpine foreland (Germany)	Oberdorfer	1971
4952		Roadside banks in Großraming (Upper Austria)	Oberforster in Mucina, Grabherr et Ellmauer 1993 	1986
4952	3	Main-Tauber area, Hohenlohe, Neckar area, Upper Rhine area, Alb foreland, Danube and Isar, Swabian-Franconian Forest, Odenwald, Black Forest, Swabian Alb, Baar plateau, Allgäu, Swiss Alpine foreland (Germany)	Seibert	1962
4952	8	Sátor-hegység, Bükk, Tornai Karszt, Matra, Szalajka valley, Visegrád-Szentendre Hills, Pilis, Bakony, Sopron (Hungary)	Soó 1964	1964
4952	1	Main-Tauber area, Hohenlohe, Neckar area, Upper Rhine area, Alb foreland, Danube and Isar, Swabian-Franconian Forest, Odenwald, Black Forest, Swabian Alb, Baar plateau, Allgäu, Swiss Alpine foreland (Germany)	Th. Müller	1974
4952	76	Main-Tauber area, Hohenlohe, Neckar area, Upper Rhine area, Alb foreland, Danube and Isar, Swabian-Franconian Forest, Odenwald, Black Forest, Swabian Alb, Baar plateau, Allgäu, Swiss Alpine foreland (Germany)	Th. Müller	n.n.
4952	2	Main-Tauber area, Hohenlohe, Neckar area, Upper Rhine area, Alb foreland, Danube and Isar, Swabian-Franconian Forest, Odenwald, Black Forest, Swabian Alb, Baar plateau, Allgäu, Swiss Alpine foreland (Germany)	Ullmann	1977
4953		on the banks of ditches in Hochstraß (Austria)	Forstner in Mucina, Grabherr et Ellmauer 1993 	1994
4953		on the banks of ditches in Langau (Austria)	Forstner in Mucina, Grabherr et Ellmauer 1993 	1994
4953		on the banks of ditches in Lichtenegg (Austria)	Forstner in Mucina, Grabherr et Ellmauer 1993 	1994
4953	9	Allgäu, Lake Constance region, Neckar region, Upper Rhine region, Swabian Alb (Germany)	Görs	1974
4953		Rhein valley in Vorarlberg (Austria)	Grabherr et Polatschek in Mucina, Grabherr et Ellmauer 1993 	1986
4953	n.n.	all French Regions except Provence-Alpes, Pyrénées, Nouvelle-Aquitaine  (France)	Julve 	2024
4953	n.n.	Banks of watercourses, ditches and bodies of water, edges of alkaline marshes in Departments Cher,  l'Eure-et-Loir, Indre, Indre-et-Loire, Loir-et-Cher, Loiret (France)    	Pujol et al. 2023	n.n.
4953	1	from a larger river in the area of Hungary	Soó 1964	1964
4953	2	Allgäu, Lake Constance area, Neckar area, Upper Rhine area, Swabian Alb (Germany)	Th. Müller	1974
4953	19	Allgäu, Lake Constance area, Neckar area, Upper Rhine area, Swabian Alb (Germany)	Th. Müller	n.n.
4953		on the banks of ditches in the Pinzgau (Austria)	Wittmann et Strobl in Mucina, Grabherr et Ellmauer 1993 	1990
4953		on the banks of ditches in the Pongau (Austria)	Wittmann et Strobl in Mucina, Grabherr et Ellmauer 1993 	1990
4954	21	mainly in lowland and colline areas of the Czech Republic	Chytry et al. 2009	1975/2009
4954	1	Danube, Echaz, Enz, Fils, Jagst, Kocher, Main, Murr, Neckar, Upper Rhine, Rems, Tauber, Wörnitz (Germany)	Görs	1969
4954	2	Danube, Echaz, Enz, Fils, Jagst, Kocher, Main, Murr, Neckar, Upper Rhine, Rems, Tauber, Wörnitz (Germany)	Görs	1974
4954		on the banks of ditches in the Pannonian oak region of Austria, e.g. in the Thaya valley	Grabherr et Polatschek in Mucina, Grabherr et Ellmauer 1993 	1986
4954		on the banks of ditches in the Pannonian oak region of Austria, e.g. in the  Vorarlberg valleys	Hübl et Holzner in Mucina, Grabherr et Ellmauer 1993 	1977
4954	18	widespread on major rivers (Hungary)	Soó 1964	1964
4954	26	Danube, Echaz, Enz, Fils, Jagst, Kocher, Main, Murr, Neckar, Upper Rhine, Rems, Tauber, Wörnitz (Germany)	Th. Müller	1969
4954	34	Danube, Echaz, Enz, Fils, Jagst, Kocher, Main, Murr, Neckar, Upper Rhine, Rems, Tauber, Wörnitz (Germany)	Th. Müller	n.n.
4954	3	Danube, Echaz, Enz, Fils, Jagst, Kocher, Main, Murr, Neckar, Upper Rhine, Rems, Tauber, Wörnitz (Germany)	Ullmann	1977
4955	1	Altmühl, Danube, Iller, Isar, Main (Germany)	Lohmeyer	1957
4955	1	Altmühl, Danube, Iller, Isar, Main (Germany)	Runge	1975
4955	3	Altmühl, Danube, Iller, Isar, Main (Germany)	Seibert	1962
4955		on the banks of large rivers, e.g. on the Danube near Stockerau (Austria)	Straka in Mucina, Grabherr et Ellmauer 1993 	1992
4955	28	Altmühl, Danube, Iller, Isar, Main (Germany)	Th. Müller	n.n.
4955	14	Altmühl, Danube, Iller, Isar, Main (Germany)	Zahlheimer	1979
4956	9	common at middle altitudes of the Czech Republic	Chytry et al. 2009	1975/2009
4956		in the habour of Linz (Austria)	Geißelbrecht-Taferner in Mucina, Grabherr et Ellmauer 1993 	1991
4956		Rhein valley in Vorarlberg (Austria)	Grabherr et Polatschek in Mucina, Grabherr et Ellmauer 1993 	1986
4956		on the banks of Bodensee (Austria)	Grabherr et Polatschek in Mucina, Grabherr et Ellmauer 1993 	1986
4956		on the banks of ditches in the Bucklige Welt (Austria)	Holzner et al. in Mucina, Grabherr et Ellmauer 1993 	1978
4956		on the banks of ditches in the Ernstbrunn forest (Austria)	Holzner et al. in Mucina, Grabherr et Ellmauer 1993 	1978
4956		on the banks of ditches in the Wachau (Austria)	Hübl et Holzner in Mucina, Grabherr et Ellmauer 1993 	1977
4956		on the banks of ditches in Vienna forest (Austria)	Hübl et Holzner in Mucina, Grabherr et Ellmauer 1993 	1977
4956		on the banks of ditches in the Weinviertel (Austria)	Hübl et Holzner in Mucina, Grabherr et Ellmauer 1993 	1977
4956	n.n.	all French Regions except Provence-Alpes, Occitanie  (France)	Julve 	2024
4956	4	Neckar area, Upper Rhine area, Kaiserstuhl, Swabian Alb, Altmühl (Germany)	Oberdorfer	n.n.
4956	8	Neckar area, Upper Rhine area, Kaiserstuhl, Swabian Alb, Altmühl (Germany)	Philippi	n.n.
4956	n.n.	Riverbanks and ditches with periodic flooding and slow currents in Departments Cher, Indre, Loiret (France)    	Pujol et al. 2023	n.n.
4956	2	Neckar area, Upper Rhine area, Kaiserstuhl, Swabian Alb, Altmühl (Germany)	Runge	1975
4956		on the banks the Melk river (Austria)	Schlesinger in Mucina, Grabherr et Ellmauer 1993 	1990
4956	11	Neckar area, Upper Rhine area, Kaiserstuhl, Swabian Alb, Altmühl (Germany)	Th. Müller	n.n.
4957		on the banks of the Danube in Vienna (Austria)	Jackowiak et Grabherr in Mucina, Grabherr et Ellmauer 1993 	1990
4957	20	Havelland, Middle-Mecklenburg, East-Brandenburg (Germany)	Passarge	1957
4958	21	subalpine belt of the Krkonoše, Hrubý Jeseník, Králický Sněžník and Šumava Mountains (Česko)	Chytry et al. 2007	2007
4958	n.n.	Hohe Tauern (Central Alps Carinthia/Austria)	Gams	1936
4958		Vorarlberg (Austria)	Grabherr et Pollatschek in Grabherr et Mucina 1993	1986
4958	n.n.	Vorarlberg (Austria)	Grabherr, Polatschek	1986
4958	n.n.	Vorarlberg (Austria)	Hermann	1990
4958	n.n.	Hohe Tauern (Central Alps Carinthia/Austria)	Medicus	1981
4958		High Tauern mountains (Carinthia, Austria)	Medicusin Grabherr et Mucina 1993	1981
4958	n.n.	Hohe Tauern (Central Alps Carinthia/Austria)	Schiechtl et al.	1985
4958	n.n.	Hohe Tauern (Central Alps Carinthia/Austria)	Wittmann, Strobl	1990
4959	n.n.	Middle- Ötztal (Tyrol/Austria)	Mucina	n.n.
4959		Ötztal Alps (Tyrol, Austria)	Mucina in Grabherr et Mucina 1993	1993
4960	n.n.	Montafon (Vorarlberg/Austria)	Hermann	1990
4960		Montafon (Austria)	Hermann in Grabherr et Mucina 1993	1990
4960	n.n.	Carpathians	Krajina	1933
4960	n.n.	Berchtesgaden Alps (subalpine level)	Lippert	1966
4960		Berchtesgaden Alps (Austria)	Lippert in Grabherr et Mucina 1993	1966
