Comm_ID,Account of relevés,Locations of relevés,Authors,Year of occurances
2056,3,Midlands of Switzerland,J.L. Richard in Ellenberg et Klötzli 1972,1966
2056,7,Island of Wollin(Poland),Piotrowska,1955
2057,5,Upper Palatinate Jura (Germany),Rosskopf,1971
2057,21,"Ore Mountains, upper Vogtland, near Mittelsaida (Germany)",Schmidt,n.n.
2058,1,Kessler moss near Erlenbruck (Germany),Bartsch,1940
2058,1,Hinterzarten mire (Germany),Bartsch,1940
2058,1,"Swiss Jura, northern marginal Alps and central Alps (Switzerland)","Braun-Blanquet, Pallmann et Bach",1954
2058,4,"Upland moors of the southern Black Forest: Eschengrundmoos, Unter-Ibacher Moor, Horbacher Moor, Föhrenmoos near Unter-Ibach (Germany)",A. Schumacher,1937
2058,14,"Swiss Jura, northern marginal Alps and central Alps (Switzerland)",Lüdi in Ellenberg et Klötzli 1972,1966
2058,1,"Nature reserve Fohrenmoos near Ibach, district of Säckingen (Germany)",Th. Müller,1960
2058,3,Black Forest (Germany),Bartsch,1940
2058,1,Border zone of the Hirschenmoor near Hinterzarten (Germany),Bartsch,1940
2058,1,"Nature reserve Schollacher Moos, Schollach, Neustadt district (Germany)",Th. Müller,1960
2058,29,Ore Mountains (Germany),Schmidt,n.n.
2058,41,"Swiss Jura, northern marginal Alps and central Alps (Switzerland)",Kuoch,1954
2058,5,Black Forest (Germany),Kaule,n.n.
2058,14,Black Forest (Germany),Th. Müller,n.n.
2058,1,Great Muhr near Untersmatt (Germany),Bartsch,1940
2058,1,"Schliffkopf nature reserve, district of Bühl, Offenburg, Freudenstadt (Germany)",Th. Müller,1960
2058,3,"Nature reserve Wildseemoor near Wildbad, district Calw (Germany)",Th. Müller,1960
2058,3,Alpine foothills (Germany),Lutz,1956
2058,1,High moor area of the Grosse Muhr (Germany),Oberdorfer,1938
2058,1,Southwest corner of the Schluchsee (Germany),Oberdorfer,1935
2058,40,mountain ranges of the Bohemian Massif along the international border (Czech Republic),Chytry et al. 2011,1975/2011
2058,22,in some mountainous areas and basins of the Bohemian Massif (Česko),Chytry et al. 2013,1975/2013
2058,4,Black Forest (Germany),Oberdorfer,1938
2058,8,"Swiss Jura, northern marginal Alps and central Alps (Switzerland)",J.L. Richard in Ellenberg et Klötzli 1972,1966
2059,56,mountain ranges along the state border within the Bohemian Massif (Česko),Chytry et al. 2013,1975/2013
2059,13,"Ore Mountains, Nature Protected Area  Alter Floßgraben, Nature Protected Area  Mothäuser Heide (Germany)",Schmidt,n.n.
2060,4,"Mecklenburg, Brandenburg and Altmark (Germany)",Fukarek,1961
2060,20,"Mecklenburg, Brandenburg and Altmark (Germany)",Kudoke,1961
2060,7,near Kartuzy (NW Poland near Gdansk),"Langguth, Kopp and  Passarge",1961
2060,8,"Mecklenburg, Brandenburg and Altmark (Germany)",Passarge,1961
2060,n.n,"at Oizon (Departement Cher, France) in the Pays-Fort region",Pujol et al. 2023,n.n.
2060,11,"Border Upper Lusatian Highlands, Lower Jahna Valley, Mühlbusch Lehn, Partheniederung",Schmidt,n.n.
2060,n.n,"Streams, small rivers, seeps, pond tails and belts. At the transition to marshy alder stands. Fairly common in France and the Departments Cher, Loiret (France)    ",Pujol et al. 2023,n.n.
2061,1,"Black Forest, Bavarian Forest, Allgäu, Bavarian Alps (Germany)",Baier,1974
2061,18,Small areas on the Rhine valley slope and on Eschner Berg (Liechtenstein) ,Schmider et Burnand 1988,1988
2061,6,Leinebergwald (Germany),Rühl,1954
2061,12,Leinebergwald (Germany),Rühl,1960
2061,1,Midlands and Jura of Switzerland,Winteler,1927
2061,145,"Growth districts: 1 Northern Hochösling, 2 Southern Hochösling, 3 Obersauer-, Wiltz-, Clierf- and Bleestal (Luxembourg)",Niemeyer et al. 2010,2010
2061,21,"Black Forest, Bavarian Forest, Allgäu, Bavarian Alps (Germany)",Storch,1983
2061,12,"Low mountain ranges south of Hannover, Harz, (steep shady cool rocky outcrops on silicate and limestone) (Germany)",Tüxen,1937
2061,1,"Black Forest, Bavarian Forest, Allgäu, Bavarian Alps (Germany)",Oberdorfer,1950
2061,2,Midlands and Jura of Switzerland,Moor,1952
2061,1,"Black Forest, Bavarian Forest, Allgäu, Bavarian Alps (Germany)",Herter,1990
2061,4,Northern Black Forest and foothills (Germany),Hartmann,1955
2061,2,"Black Forest, Bavarian Forest, Allgäu, Bavarian Alps (Germany)",S. Görs,n.n.
2061,3,Midlands and Jura of Switzerland,Wirz,1958
2061,5,Midlands and Jura of Switzerland,Kuhn et Zeller in Ellenberg et Klötzli 1972,1966
2061,2,Midlands and Jura of Switzerland,Kuoch,1954
2061,3,"Black Forest, Bavarian Forest, Allgäu, Bavarian Alps (Germany)",Lippert,1966
2061,17,Midlands and Jura of Switzerland,Klötzli in Ellenberg et Klötzli 1972,1966
2061,2,Midlands and Jura of Switzerland,Moor,1958
2061,7,"Black Forest, Bavarian Forest, Allgäu, Bavarian Alps (Germany)",Müller,1969
2061,1,Midlands and Jura of Switzerland,Bardet in Ellenberg et Klötzli 1972,1966
2061,1,Midlands and Jura of Switzerland,Gams,1927
2061,5,Midlands and Jura of Switzerland,Fritschi in Ellenberg et Klötzli 1972,1966
2061,5,Midlands and Jura of Switzerland,Frehner,1963
2061,4,"Black Forest, Bavarian Forest, Allgäu, Bavarian Alps (Germany)",Feldner,1981
2061,18,Midlands and Jura of Switzerland,J.-L. Richard in Ellenberg et Klötzli 1972,1966
2061,1,Midlands and Jura of Switzerland,Beger,1922
2061,13,Midlands and Jura of Switzerland,Etter,1947
2061,1,Midlands and Jura of Switzerland,Etter et Morier-Genoud,1963
2061,12,Hessian Highlands (Germany),Hartmann,1951
2062,1,Kummerow Basin and Peene Valley between Saalem and Upost (Germany),Wollert,1993
2062,10,Stream sections in the district of Güstrow (Germany),Wollert and  Bolbrinker,1994
2062,11,at the edge of the Malchin Basin (Germany),Wollert,1984
2062,35,Erosion channels to the Malchin and Teterow basins (Germany),Wollert,1973
2062,3,Nature Protected Area  Kucks- and Lapitzer Lake (Germany),Mohr and  Hofmann,1992
2062,1,Nature Protected Area  Hellberge (Germany),Mohr,1994
2062,18,"Wutach area, Lake Constance area, Neckar area, Swabian Alb, Swabian-Franconian Forest, eastern Alpine foothills (Germany)",Michiels,1986
2062,10,South-East Rügen Biosphere Reserve (Germany),Kurschat,1993
2062,20,Riparian vegetation in the Warnow catchment area (Germany),Clausnitzer,1993
2062,9,Ralower wood (Germany),Griesel et al.,1993
2062,n.n.,Medio-European France,Julve ,2024
2062,1,Wilsickower Os (Germany),Kaussmann et al.,1982
2062,1,"Trebel, Trebel canal (Germany)",Bolbrinker,1992
2062,5,Nature Protected Area  push end moraine north of Remplin (Germany),Voigtländer,1996
2062,141,"Wutach area, Lake Constance area, Neckar area, Swabian Alb, Swabian-Franconian Forest, eastern Alpine foothills (Germany)",Pfadenhauer,1969
2062,10,Inland coast Mönchsgut Rügen (Germany),Polte,1996
2062,3,Eldena nature reserve (Germany),Spangenberg,1999
2062,6,"Wutach area, Lake Constance area, Neckar area, Swabian Alb, Swabian-Franconian Forest, eastern Alpine foothills (Germany)",Stangl,1985
2062,97,"Wutach area, Lake Constance area, Neckar area, Swabian Alb, Swabian-Franconian Forest, eastern Alpine foothills (Germany)",Th. Müller,n.n.
2062,1,Brühler Bach in the Weitendorf area (Germany),Voigtländer,1993
2062,1,"Wutach area, Lake Constance area, Neckar area, Swabian Alb, Swabian-Franconian Forest, eastern Alpine foothills (Germany)",Sebald,1983
2062,21,"Wutach area, Lake Constance area, Neckar area, Swabian Alb, Swabian-Franconian Forest, eastern Alpine foothills (Germany)",Schrag,1985
2062,1,Island of Vilm (Germany),Schötteldreier,1995
2062,1,"Wutach area, Lake Constance area, Neckar area, Swabian Alb, Swabian-Franconian Forest, eastern Alpine foothills (Germany)",S. Görs,n.n.
2062,8,"Wutach area, Lake Constance area, Neckar area, Swabian Alb, Swabian-Franconian Forest, eastern Alpine foothills (Germany)",Seiffer,1984
2062,4,"Wutach area, Lake Constance area, Neckar area, Swabian Alb, Swabian-Franconian Forest, eastern Alpine foothills (Germany)",Seibert,1969
2062,9,"Wutach area, Lake Constance area, Neckar area, Swabian Alb, Swabian-Franconian Forest, eastern Alpine foothills (Germany)",Seibert,1962
2062,2,"Wutach area, Lake Constance area, Neckar area, Swabian Alb, Swabian-Franconian Forest, eastern Alpine foothills (Germany)",Seibert,1958
2062,13,"Nature reserve Weißeritztalhänge, Müglitztal south of railroad station Burkhardswalde-Maxen, Nature reserve Wesenitztalhang near Zatschke (Germany)",Schmidt,n.n.
2062,1,"Wutach area, Lake Constance area, Neckar area, Swabian Alb, Swabian-Franconian Forest, eastern Alpine foothills (Germany)",Oberdorfer,1971
2062,131,"Growth districts: 3 Obersauer-, Wiltz-, Clierf- and Bleestal, 10 Eisch-Mamer-Gutland, 11 Schooffielser and Müllerthaler Gutland, 14 Pafebierger and Oetringer Gutland (Luxembourg)",Niemeyer et al. 2010,2010
2062,1,Schaalsee Landscape Nature Park (Germany),Mordhorst,1997
2062,6,Forests of the young moraine landscape around Dargun (Germany),Passarge,1959
2062,6,North--West Mecklenburg (Germany),Passarge,1960
2062,12,South-East Rügen (Germany),Paulson and  Raskin,1998
2063,3,Lower Vogtland and Saale area (Germany),F. K. Hartmann,1956
2063,22,Lower Vogtland (valley of the White Elster) (Germany),Niemann,1956
2064,20,Harz (Germany),Stöcker,1962
2065,n.n.,"Ore Mountains, Zittau Mountains (e.g. Bärenstein, Pöhlberg, Geising, Lausche) (Germany)",Schmidt,n.n.
2065,12,Röhn (Germany),"Lohmeyer, Bohn",1972
2066,3,Linz/Danube (Austria),Stockhammer,1964
2066,5,"Along the Danube, Szigetköz, Csepel-sziget, Baja vidéke, Tisza (Hungary)",Soó 1964,1964
2066,1,Salzach floodplains in Flachgau and Tennengau (Salzburg),Jelem,1965
2066,4,"montane and submontane rivers, especially in the Šumava and Moravskoslezské Beskydy Mountains (Česko)",Chytry et al. 2013,1975/2013
2066,1,Danube floodplain near Neuburg (Germany),Seibert,n.n.
2066,3,Lech estuary (Germany),Seibert,n.n.
2066,2,Chiemsee (Germany),"Schauer, Duensing",n.n.
2066,3,Isar floodplain north of Munich (Germany),Seibert,1962
2066,9,"Tullnerfeld and Wachau, Marchfeld and Korneuburger Berge (Austria)",Jelem,1974
2066,4,"Drava between Mauthbrücken and Sachsenburg (Carinthia, Austria)",Egger,1992
2066,6,Eastern edge of the Alps (Austria),Knapp,1944
2066,17,Inn floodplains near Braunau (Austria),Krammer,1953
2066,2,Inn valley between Telfs and Wörgl (Austria),Krewedl,1992
2066,n.n.,Département Ardennes  (France),Julve ,2024
2066,4,Riverine forests of the alpine foothills of Lower Austria,Rauscher,1990
2066,n.n,"On coarse subtrates subject to river dynamics in Departments Cher, Loiret (France)    ",Pujol et al. 2023,n.n.
2066,7,Danube floodplains near Wallsee (Austria),Wendelberger-Zelinka,1952
2066,8,Isar estuary (Germany),Linhard,1964
2067,44,"upper Danube, Lauter, Kocher and Neckar valleys (Germany)",Müller,n.n.
2067,1,Salzach floodplains in Flachgau and Tennengau (Salzburg),Jelem,1965
2067,n.n.,Vorarlberg and Salzburg (Austria),"Grabherr, Polatschek",1986
2067,4,Taubergießen (Upper Rhine),Müller,1974
2067,5,"Elbe valley near Boitzenburg, Dömitz and Rüterberg (Germany)",LAG Vegetationskunde MV,2000
2067,2,Riverine forests along the Leitha (Austria),Lazowski,1989
2067,n.n,"at Herry (Departement Cher, France) on the banks of the Loire",Pujol et al. 2023,n.n.
2067,n.n,"Banks of watercourses, rarely of water bodies, subject to heavy flooding and high tides  in Departments Cher, Indre-et-Loire, Loiret (France)    ",Pujol et al. 2023,n.n.
2067,10,"at Our, Moselle, Wark, Attert and Kailsbaach (Luxembourg)",Niemeyer et al. 2010,2010
2067,2,Upper Rhine and Günztal (Germany),Oberdorfer,1957
2067,5,"Aitrach, Iller and Argental valleys (Germany)","Müller, Görs",1958
2067,5,Illertal valley (Germany),Müller and  Görs,1958
2067,20,lower Murrtal (Germany),Müller,1985
2067,n.n.,Vorarlberg and Salzburg (Austria),"Wittmann, Strobl",1990
2067,7,Upper Swabia (Germany),Th. Müller,n.n.
2067,4,at the Giessgang in the Danube floodplains between Altenwörth and Korneuburg (Austria),Straka,1992
2067,9,Vojvodina,Slavnic,1952
2067,8,Isar floodplain near Wolfratshausen (Germany),Seibert and  Zielonkowski,1972
2067,1,Isar floodplain near Wolfratshausen (Germany),Seibert and  Conrad,n.n.
2067,3,Lech estuary (Germany),Seibert,n.n.
2067,3,Rott valley near Ruhstorf (Germany),Seibert,n.n.
2067,4,Isar floodplains north of Munich (Germany),Seibert,1962
2067,1,Upper Lech Valley (Germany),Karl,1954
2067,21,"Tullnerfeld and Wachau, Marchfeld and Korneuburger Berge (Austria)",Jelem,1974
2067,5,northwestern tertiary hill country (Lower Bavaria) (Germany),Rodi,1975
2067,2,Riverine forests of the Lower Austrian Alpine foothills,Rauscher,1990
2067,10,Danube floodplain between Regensburg and Straubing (Germany),Zahlheimer,1979
2067,1,"Drau between Mauthbrücken and Sachsenburg (Carinthia, Austria)",Egger,1992
2067,7,near Belgrade (Serbia),Gajic,1954
2067,7,Mecklenburg-Western Pomerania (Germany),Blümel and  Tepke,2000
2067,4,Isar estuary (Germany),Limhard,1963
2067,13,Inn floodplains near Braunau (Austria),Krammer,1953
2067,4,Inn floodplains near Braunau (Germany),Kramer,1953
2068,n.n.,Eastern Karawanken (Carinthia/Austria),Ranner,1988
2068,n.n.,Salzburg Limestone Alps (Austria),Schlager,1983
2068,n.n.,Gaisberg (Salzburg/Austria),Amberger,1991
2068,,"Kiens (Province South Tyrol, Italy)",AfF Südtirol,2010
2068,32,middle Northern Limestone Alps (Germany),Hölzel,1996
2068,n.n.,Lorüns (Vorarlberg/Austria),Grabherr,n.n.
2068,4,Protective forests of the Tyrolean peripheral and intermediate Alps,Hotter,1996
2068,n.n.,Mieminger Mountains/Tyrol,Weber,1981
2068,n.n.,Mieminger Mountains/Tyrol,Starlinger,1988
2068,n.n.,Northern Limestone Alps (Germany),"Mayer, Zimmermann",1974
2068,n.n.,"eastern Graubünden, Münstertal, Oberinntal (Germany)",Braun-Blanquet et al.,1954
2068,n.n.,Ammergau Mountains/Bavaria (Germany),Feldner,1978
2069,7,Bavarian Forest (Germany),Volk,1939
2069,75,"scattered in mountainous areas, but also found in the high hills and foothills (Česko)",Chytry et al. 2013,1975/2013
2069,21,Bavarian Forest (Germany),Trautmann in Matuszkiewicz,1952
2070,39,"in the Drebin, the Czech Karst, and the Posumavské hills; Bohemian mid-hills, Liběchovsku region,  Ještědském ridge, Kokořínska region, Turnov region , Podkrkonoší near Vrchlabí, the middle Posázaví near Sázavy, the Moravian Karst, near and Štramberk, Šia",Chytry et al. 2013,1975/2013
2070,8,Meiningen shell limestone area (Germany),Hofmann,1956
2071,5,Eastern and middle Sudeten,F. K. Hartmann,1942
2072,n.n.,Brandnertal (Austria),Grabherr,1988
2072,,"Deutschnofen (Province South Tyrol, Italy)",AfF Südtirol,2010
2072,n.n.,Warmbad-Villach (Carinthia/Austria),Aichinger,1957
2072,n.n.,South Tyrol (Italy),Mayer,1970
2072,n.n.,Freyenstein reserve near Ybbs (Austria),Mayer,1969
2072,n.n.,serpentine area near Kirchdorf/Styria (Austria),Maurer,1966
2072,n.n.,Styrian Gleinalpe (Austria),Karrer,1988
2072,n.n.,Switzerland,Glavac,1972
2072,n.n.,serpentine area near Kirchdorf/Styria (Austria),Eggler,1954
2072,n.n.,eastern Koralpe (Styria/Austria),Zimmermann,1976
2072,n.n.,styrian alpine east rim (Styria/Austria),"Jelem, Kilian",1975
2072,n.n.,"Granite, quartz phyllite and quartz porphyry area of South Tyrol",Putzer,1967
2072,n.n.,"Granite, quartz phyllite and quartz porphyry area of South Tyrol",Peer,1980
2072,n.n.,"Ötztal (Central Alps, Tyrol/Austria)",Ellmauer,n.n.
2072,n.n.,"Styria, adjacent parts of Lower Austria, Upper Carinthia (Austria)",Zimmermann,1975
2072,n.n.,"Granite, quartz phyllite and quartz porphyry region of South Tyrol",Zimmermann,1982
2072,n.n.,Murau Nockberge (Austria),"Jelem, Kilian",1966
2072,n.n.,Switzerland,Schweingruber,1973
2072,n.n.,"inner Ötztal, Pitz and Kaunertal, Piller Sattel (Tyrol/Austria)","Schiechtl, Stern",1975
2072,n.n.,"Ötztal (Central Alps, Tyrol/Austria)",Mucina,n.n.
2072,n.n.,Bucklige Welt south of Wiener Neustadt (Austria),Mayer,1970
2072,n.n.,southwestern Styria (Austria),Sturm,1978
2072,n.n.,Engadine (Austria),Trepp,1977
2073,n.n.,"Southwestern Styria (castle mountain of Ehrenhausen and Wilden, surroundings of Seggauberg) (Austria)",Sturm,1978
2073,n.n.,"Vorarlberg, lower slopes of the Rheintaler Inselberge, Walgau (Austria)","Grabherr, Mucina",1989
2074,1,Alpine foothills (Austria),"Hoislbauer, Starke",1975
2074,2,Vorarlberg (Austria),Huber-Sannwald,1989
2074,29,Salzach valley Upper Austria (Austria),Wieland,1994
2074,9,"Southwest Styria (surroundings of Gleinz, Hohlbach, Annaberg and others) (Austria)",Sturm,1978
2074,19,Tobel slopes and terrace slopes in the Molasse area of northern Vorarlberg (Austria),Grabherr,1989
2074,5,Blühnbach valley (Austria),Günther,1978
2074,20,"Limestone Alps Lower Austria, surroundings of Lake Traun Upper Austria, Styria, Carinthia, Salzburg, Vorarlberg (Austria)",Fischer,2000
2074,n.n.,Ammergau mountains (Germany),Feldner,1978
2074,n.n.,middle Murtal (Styria/Austria),Zimmermann,1986
2074,5,Untersberg area near Salzburg (Salzburg/Austria),Strobl,1989
2074,1,Area southwest of Großraming (Austria),Starke,1975
2074,10,Alpine foothills (Austria),Rauscher,1990
2074,3,Laßnitzgraben near Deutschlandsberg (Austria),Otto,1967
2074,24,Vorarlberg (Austria),Pfeiffer,1992
2074,1,Vyzhnutsky National Nature Park (Ukraine),Onyshchenko 2009,2009
2074,2,Skolivski Beskydy National Nature Park (Ukraine),Onyshchenko 2009,2009
2074,5,Postalm (Austria),Breitfuß,1976
2074,123,"occurs scattered throughout the Czech Republic, across a broad range of altitudes, with most occurrences between 300 and 900 m (Česko)",Chytry et al. 2013,1975/2013
2074,8,"Walgau (Vorarlberg, Austria)",Amann,1992
2074,n.n.,Blühnbach valley north of Werfen near Tenneck (Austria),Günther,1978
2074,2,Schafberg area (Austria),Kaiser,1983
2074,n.n.,Mühlviertel (Upper Austria/Austria),Hofbauer,1985
2074,1,Wachau Lower Austria (Austria),Hübl and  Holzner,1977
2074,1,Gneiss mountains east of Waidh. (Austria),Jelem,1976
2074,5,low mountain forests on the eastern edge of the Alps (Austria),Knapp,1944
2074,1,"Lower Austria, Upper Austria, Styria, Carinthia, Salzburg, Vorarlberg (Austria)",Nikfeld,1979
2074,n.n.,St. Georgensberg near Stans,Mucina,n.n.
2074,n.n.,"Kitzbühel Alps (Tyrol, Salzburg/Austria)",Mayer,1963
2075,n.n.,Germany,Schubert,1972
2075,n.n.,"St. Georgensberg near Stans/Tyrol, Schneeberg area near Payerbach (Austria)",Mucina,n.n.
2075,n.n.,Germany to Eastern Slovakia,Jurko,1951
2075,n.n.,Czech Republic,Moravec et al.,1982
2075,n.n.,"Salzburg region (Golling, Großgmain, Fürstenbrunn/Austria)","Strobl, Wittmann",1988
2075,n.n.,Untersberg area (Salzburg/Austria),Strobl,1989
2075,n.n.,Germany,"Grüneberg, Schlüter",1957
2076,1,Höllengebirge (Austria),Wieland,1994
2076,31,Untersberg area (Salzburg/Austria),Strobl,1989
2076,1,"Kaiser Mountains (Northern Limestone Alps, Tyrol/Austria)",Smettan,1981
2076,1,riverine forests of the alpine foothills of Lower Austria,Ruttner,1994
2076,n.n.,Middle- Mur valley (Styria/Austria),Zimmermann,1986
2076,19,northern Limestone Alps (Upper Austria),Fischer,1997
2076,18,on the Steyr and Zufbringer (Upper Austria),Fischer,1998
2076,1,Jaidhaus valley widening near Molln (Upper Austria),Essl,1998
2076,5,"SeNature Protected Area engebirge, Pre-Alps",F. Müller,1977
2076,n.n.,Keutschach (Carinthia/Austria),"Franz, Leute",1989
2076,4,Limestone Alps (Lower Austria),Fischer,2000
2076,n.n.,Ammergau Mountains,Feldner,1978
2076,21,Northern Limestone Alps (Ob,Fischer,1997
2076,n.n.,Land Salzburg (Bluntau valley near Golling/Austria),Andorfer,1974
2076,165,at mid-altitudes throughout the Czech Republic,Chytry et al. 2013,1975/2013
2076,n.n.,Klein Walsertal (Vorarlberg/Austria),Knapp,1962
2076,n.n.,Brandnertal (Vorarlberg/Austria),Küng,1975
2076,68,Protective forests of the Tyrolean Rand- and Zwischenalpen (Austria),Huber-Sannwald,1989
2076,3,Leoganger Steinberge (Austria),Hotter,1996
2076,2,Area southeast of Großraming (Austria),Hoislbauer,1975
2076,n.n.,Blühnbach valley north of Werfen near Tenneck (Austria),Günther,1978
2076,2,Leoganger Steinberge (Austria),Gumpelmayer,1967
2076,2,shore of the Traunsee (Austria),Gumpelmayer,1967
2076,n.n.,Vorarlberg (Austria),"Grabherr, Polatschek",1986
2076,2,Vorarlberg (Austria),"Grabherr, Mucina",1989
2076,2,"Lorüns/Stallehr (Vorarlberg, Austria)",Grabherr,1989
2076,6,"Hinterer Bregenzer Wald (Vorarlberg, Austria)",Grabherr,1988
2076,5,"Dornbirn mountain area (Vorarlberg, Austria)",Grabherr,1987
2076,1,Montafon (Austria),Grabherr,1984
2076,5,"Schafberg (Upper Austria, Salzburg/Austria)",Kaiser,1977
2076,9,Vorarlberg (Austria),Knapp,1944
2076,n.n.,"Kitzbühel Alps (Tyrol, Salzburg/Austria)",Mayer,1963
2076,1,low mountain lands on the eastern edge of the Alps (Austria),Niklfeld,1979
2076,8,"Limestone Alps, Pre-Alps (Austria)",Rauscher,1990
2076,8,calcareous alpine valleys of Vorarlberg (Austria),Rauscher,1990
2076,n.n.,Vorarlberg (Austria),Peter,1991
2076,3,Steyr Bridge (Austria),Pfeifer,1992
2076,n.n.,Salzburg Limestone Alps (Austria),Schlager,1983
2077,7,Nature reserve Buchswald near Grenzach) (Germany),Th. Müller,n.n.
2077,17,"Southern Upper Rhine area (Kaiserstuhl, Isteiner Klotz, Mühlhauser Hardt) (Germany)",Th. Müller,n.n.
2077,6,"Southern Upper Rhine area (Kaiserstuhl, Isteiner Klotz, Mühlhauser Hardt) (Germany)",Stoffler,n.n.
2077,4,eastern Lake Constance area (lower Argen area)) (Germany),Speidel,n.n.
2077,3,"Southern Upper Rhine area (Kaiserstuhl, Isteiner Klotz, Mühlhauser Hardt) (Germany)",Philippi,n.n.
2077,36,montane ﬂoodplain for-ests distributed in calcareous parts of the Alps and Wes-tern Carpathians,Douda et al. 2015 ,n.n.
2077,8,eastern Lake Constance area (lower Argen area)) (Germany),Görs,n.n.
2077,2,eastern Lake Constance area (lower Argen area)) (Germany),Th. Müller,n.n.
2077,6,Tobel forests of the Salzach river bank near Ach (Upper Austria),,1973
2077,1,"Southern Upper Rhine area (Kaiserstuhl, Isteiner Klotz, Mühlhauser Hardt) (Germany)",Buchwald,n.n.
2077,1,"Southern Upper Rhine area (Kaiserstuhl, Isteiner Klotz, Mühlhauser Hardt) (Germany)",Hügin,1979
2077,15,eastern Lake Constance area (lower Argen area)) (Germany),Hügin,1979
2078,3,Mirov peat bog (Germany),Berg and  Thiess,1993
2078,1,Vilm Island (Germany),Bochnig,1959
2078,12,North-west Mecklenburg young moraine landscape (Germany),Henker,1972
2078,2,River valley moor of the Recknitz (Germany),Clausnitzer,1998
2078,2,Nature Protected Area  Moorer Busch (Germany),Brandt,1993
2078,1,Darß (Germany),Fukarek,1961
2078,17,Fens in the Great Friedland Meadow (Germany),Roth,1995
2078,1,Mecklenburg and Brandenburg (Germany),Passarge,1968
2078,6,North--West Mecklenburgv,Passarge,1960
2078,1,Forests of the young moraine landscape around Dargun (Germany),Passarge,1959
2078,1,Nature Protected Area  Heiligensee and Hütelmoor (Germany),Scheller and  Voigtländer,1995
2078,3,Mecklenburg and Brandenburg (Germany),Hofmann,1968
2078,4,Nature reserve Buchswald near Grenzach) (Germany),Schlüter,1955
2078,1,Nature Protected Area  Moorheide near Melkof in the Elbetal Nature Park (Germany),Schmiedel,1996
2078,8,Surroundings of the Rostock-Poppendorf fertilizer plant (Germany),Schmidt,1987
2078,1,Valley of the Blind Trebel (Germany),Vegelin and  Nijhof,1996
2078,1,Nature Protected Area  Plöwen lake marsh (Germany),Voigtländer,1995
2078,1,Nature Protected Area  upsetting moraine north of Remplin (Germany),Voigtländer,1996
2078,1,Nossentiner-Schwinzer Heath Nature Park (Germany),Schumann,1996
2078,1,Nature Protected Area  Lake Santow (Germany),Voigtländer,1996
2078,2,Nienhagen-Carlsdorf Forest (Germany),Wollert,1992
2078,2,Wendischhagen intermediate lime bog at Lake Malchin (Germany),Wollert,1992
2078,1,Valley of the Upper Warnow near Schwaan (Germany),Wollert,1992
2078,1,Rogeetz area (Germany),Wollert,1994
2078,2,Upper Mildenitz (Germany),Degen et al.,1997
2078,5,Nature Protected Area  Peenewiesen near Gützkow (Germany),Fischer,1995
2078,2,Bogs in the Lobusnath area between the Krakow and Malchin end moraine arches in the Carlsdorf-Nienhagen area (Germany),Wollert,1996
2078,3,Darß (Germany),Libbert,1940
2078,6,Warnow (Germany),IBS Schwerin,1994
2078,4,Nature Protected Area  dry slopes of Jülchendorf and Schönlager lake (Germany),Jacob et al.,1996
2078,3,Mecklenburg and Brandenburg (Germany),Jeschke,1962
2078,2,headwaters on the northern shore of Krüselinsee lake (Germany),Jeschke,1962
2078,31,Stubnitz (Jasmund Nature Protected Area ) (Germany),Jeschke,1964
2078,1,Peat bogs in the Great Friedland Meadow (Germany),Knapp,1997
2078,1,Nature Protected Area  east bank of the Feisneck near Waren (Germany),Knapp and  Voigtländer,1983
2078,15,South-East Rügen (Germany),Paulson and  Raskin,1998
2078,3,Fen lowlands near Serrahn (Germany),Paulson and  Tautz,1995
2079,1,West and North- Mecklenburg and West Brandenburg (Germany),Jeschke,1964
2079,7,West and North- Mecklenburg and West Brandenburg (Germany),Passarge,1960
2081,22,Hungaria,Horvat,1959
2081,3,Austria,"Hübl, Holzner",1977
2081,1,Poland,Hueck,1939
2081,1,Poland,Hueck,1939
2081,2,France,Issler,1942
2081,3,France,Issler,1942
2081,12,Swiss midlands from Nyon to Rorschach,J.-L. Richard in Ellenberg et Klötzli 1972,1966
2081,2,Austria,Jelem,1976
2081,10,Austria,"Jelem, Mader",1969
2081,41,Austria,K. Zukrigl,n.n.
2081,12,Austria,K. Zukrigl,n.n.
2081,2,Austria,Dunzendorfer,1974
2081,2,Austria,Eder,1993
2081,9,Austria,Knapp,1944
2081,13,Austria,Kosir,1994
2081,2,Czech Republic,"Kucera, Jirásek",1994
2081,7,northern Jutland,Passarge,1966
2081,35,middle Jutland,Passarge,1966
2081,19,Prignitz (Germany),Passarge,1966
2081,29,Middle- and East-Brandenburg (Germany),Passarge,1968
2081,7,"northern hill country (Kraichgau, Untermaingebiet), Neckar-Main area, Steigerwald, northwestern Alpine foothills (northern Upper Swabia) (Germany)",Philippi,1983
2081,4,Hungary,Pócs et al.,1958
2081,1,Swiss midlands from Nyon to Rorschach,Rehder,1962
2081,9,Austria,Reitter-Hebenstreit,1984
2081,2,France,Richard,1961
2081,16,Switzerland,Richard,1961
2081,5,Germany,"Rückert, Wittig",1984
2081,9,Germany,Meusel,1937
2081,10,Czech Republic,Mikyská,1972
2081,2,Czech Republic,Mikyská,1972
